"during the 1987  tradition  democratic national‘ convention, the mayor of atlanta said, “we want to be an american city first and a southem city second.""",1989-1990
"this timely cinematic essay, which stars richard gere and gene hackman, criticizes the growing reliance of politics on alternative power-holders besides the traditional democratic and non-democratic homo politicus.",1989-1990
"reiss wilks, young democrats president, anticipated a victory for wilder.",1989-1990
"statewide, the democrats enjoyed considerable success.",1989-1990
dalton and benedetti were defeated by democrats  donald s. beyer jr. and incurnbant mary sue terry.,1989-1990
"yoder contrasted the spray-painting of national monuments, which he considers vandalism, with ﬂag  defense  democrats deployed in order to abuse.",1989-1990
"l. douglas wilder, in a political masterstroke, raised it in the recent, somewhat bitter race for governor — and the result appears to have been a narrow victory for the moderate democrat.",1989-1990
"for years, the democrats have based their pro—choice argument on a tenuous ‘when does life begin’ assortion.",1989-1990
"going to make an impact in joumal— y» ism, it was todd,” said tallahassee democrat columnist david lee sim\' mons, a high school friend ofj, smith’s.",1989-1990
"the execution of ceaucescu indicates that not all of the eastern european upheavals are “democratic.""",1989-1990
"barnes called the recent  events in eastern europe ""the greatest democratic awakening in history.” he listed his reasons for the fall of communism.",1989-1990
"kovic’s struggles become, not only the surviving the ﬁerce ﬁre—ﬁghts, but also to hold onto those proud ideals of arnerican glory and democratic freedom that rang in his ears.",1989-1990
"let\'s hope that the charnorro government proves to be different than the other u.s.backed governments of central america, past and present, which have been fundamentally counter-revolutionary, and recognizes that a democratic government must be for, of, and by the people, and not the protectorate for the privileges of the elite.",1989-1990
one by one democratic ideals were betrayed.,1989-1990
"the american__ revolutionary, leaders never lied about their goals, were as democratic as possible, and encouraged so much initial public criticism that they had to completely scrap their initial plan of government and draft a new one, which they subsequently sent to the people for approval.",1989-1990
"however, a greater threat to one’s rational judgement is the eagerness to interpret important events based on ideological agendas — agendas developed not for the purpose of understanding the truth, but for perpetuating fundamentally unjust and undemocratic power structures.",1989-1990
"in 1954, the eisenhower administration planned and funded the overthrow of the arbenz government of guatemala — which came to power through one of the fairest and most open and democratic elections in that nation’s history.",1989-1990
"‘democratic’  my view -.by;rala-n;:heinrich—::.‘rr.it ~  the recent democratic revolutions in eastern europe provide western audiences not only with a reprieve from the same old wom-out headlines, but also with an opportunity to reﬂect upon the status of some of the words invoked so often in our own culture, in so far as they are understood by the leaders of our government and of the mass media.",1989-1990
a country that routinely beholds the murder of its opposition ieaders  is a far cry from being democratic.,1989-1990
"clearly, a country that routinely beholds the murder of its opposition leaders (regardless of whether the civilian leadership —for example, christiani or cerezo — is corrupt (as the evidence, such as the absence of any successful prosecution of the perpetrators of these anti-democratic acts suggests), or simply irripotent and serving as the figureheads of military states for the betterment of their nation\'s international image) is a far cry from being democratic, ﬂedgling or otherwise.",1989-1990
"this ignorance has far-reaching consequences.‘ the institution that defines, and thereby in essence‘ creates, public opinion, along with the individuals and bureaucratic structures that pander to this) public opinion, together profess the heresy that we , needn\'t be vigilant in defence of true democratic ‘ representation; again, because you either got it on you don’t.",1989-1990
"to this he replied, “i’m not that much of l a democrat.""",1989-1990
"wilder, a democrat and the grandson of a slave, is the first elected black governor in u.s.  wilder narrowly won.",1989-1990
"‘*perestroika’’ is supposed to denote the soviet union’s recent move towards democratic reform , but it sounds more like a soviet slang word for male genitalia or a drink tasting like a harvey wallbanger that one might order in a bar.",1990-1991
orientation  the mock convention steering committee will hold two oricntation sessions for students inicrested in participating in the 1992 mock democratic convention.,1990-1991
the 1992 mock democratic convention is already in the planning stages.,1990-1991
the 1992 mock democratic convention has an 84-year-tradition of authenticity to uphold.,1990-1991
for the democratic presidential candidate.,1990-1991
rockbridge county was split into two districts by the democrat-controlled state assembly after the 1980 census.,1990-1991
"edward henneman, chairman of the rockbridge county democratic committee, said rockbridge county should be united with bath and allegheny counties because the three are all mainly agricultural areas and have the same types of people in them.",1990-1991
"‘*the fact is, the democrats want , to unite us with covington and clifton forge, two industrial cities that ‘ are democratic strongholds,’’ said , dean.",1990-1991
":  “‘the democrats couldn’t defeat , wilkins after they carved up the county in 1981. now thay’re trying ‘ to gerrymander it back again to try to defeat him,’’ dean said.",1990-1991
"henneman said he thought the , chances of the democrats’ proposal being adopted by the house of dele.",1990-1991
"‘‘keep in mind, the re-districting \' will be done by the house of dele, gates, which is controlled by the democrats,’ he said.",1990-1991
"‘‘i would hope * this plan would produce a democratic delegate from our area, but it doesn’t ‘ gaurantee it.”’ ‘  .",1990-1991
"prior to the election, democrats had hoped that voter disgust with the federal budget would propel them to an overwhelming majority in both houses in congress.",1990-1991
"the democrats also picked up another seat in the senate, bringing their majority to 56-44.  among the most controversial races was the senate contest in north carolina between sen. jesse helms and former charlotte mayor harvey gantt.",1990-1991
"cnn called williams’ collapse ‘‘a textbook example of blowing a lead.’’  in florida, another state which will have a much larger congressional delegation, former sen. lawton chiles, a democrat, defeated incumbent bob martinez.",1990-1991
"‘‘the united states contends that it may need to compel the governor     by joshua manning  this weekend, the washington and lee religion department will host three internationally known scholars  titled ‘‘justice and the future of  beginning on sunday afternoon, social philosophers hugo assmann, michael novak and max stackhouse will present their widely divergent views on the justice of democratic capitalism.",1990-1991
"assman’s lecture will be delivered in lee chapel on sunday at 4 p.m.  novak, a sociologist, is a noted defender of democratic capitalism.",1990-1991
"for information, please call josh at 463-2397, or colin at 463-9286.  orientation  the mock convention steering committee will hold two orientation sessions for students interested in participating in the 1992 mock democratic convention.",1990-1991
"the committee has also asked for the help of the faculty and administration in contacting a list of potential speakers that ‘‘command a_ national presence within the democratic party.’’  — by andrew tucker  family-owned businesses best, consultant says  family-owned companies have to brace themselves for tough times ahead, but they can still fight back, the president of a family business consulting firm told washington and lee students monday.",1990-1991
"mcgovern has said he will run for president if he can raise $5,000 in each of 20 states by may and if no other democrat who shares his views gets into the race, according to a washington post article.",1990-1991
"‘‘he is one of the only people who has shown interest in the democratic nomination,”’ mc speakers chairman edward ‘‘ted’’ elliot said.",1990-1991
"mcgovern sought the democratic nomination again in 1984, but the party chose walter mondale.",1990-1991
"but sometimes, at w&l and in the world in general, things come up that we have to concern ourselves with to fulfil our obligations as good citizens in a democratic system.",1990-1991
"“it would not hesitate to yield to, a better candidate.’’  a small potion of the crowd applauded when mcgovern called for cuts in defense spending to be a vital part of the democratic platform.",1990-1991
— cnn anchor susan rook beginning a background piece on democratic presidential candidate tom harkin.,1991-1992
".  .  < \x0c|  :  ;  the ring-tum phi, september 19, 1991     eee  — news  page 3     hirshon urges political action     hirshon     by pamela kelley associate editor  “i swear to god, i am going to drive my point home, and actions speak the loudest,’’ said russell hirshon, candidate for the 1992 democratic presidential nomination.",1991-1992
"‘‘if i had that all hell would break loose.”’  still, he hopes to visit campuses in other states and maybe even make it to the democratic national convention.",1991-1992
"the event will be held on sunday, oct. 13 at 1:30 p.m. for more information, contact burr datz at 463-3533.  frosh letter  anyone interested in working on the freshmen newsletter shouid contact christopher bray at 4638930.  internships off-campus internships are offered by: 1. nato international staff at nato headquarters in brussels, belgium (deadline is 9/30) and 2, the democratic governors association in washington, d.c. (effective immediately).",1991-1992
"\x0c   page 6  mc finally gets candidates  by spain brumby staff reporter  with the democratic presidential campaign finally taking shape, mock convention political chairman and state chairmen are busy at work.",1991-1992
"l. douglas wilder entered the race for the democratic nomination friday, followed by iowa sen. tom harkin on sunday.",1991-1992
"‘‘other candidates won\'t get early support in iowa, so they’ll look toward the new hampshire primary.’’  tucker said that state chairmen will contact democratic leaders and elected officials in their states this fall to determine how the states will receive each candidate.",1991-1992
take advantage of the first amendment and our  _ democratic atmosphere while there’s still time.,1991-1992
"»  wilder’s chances uncertain  by spain brumby staff reporter        democrats, viginians, and washington and lee mock convention chairmen agree, it is too early to determine if virginia gov.",1991-1992
douglas wilder has a shot at the democratic  \' nomination.,1991-1992
"henneman, who is the head of the democratic party in rockbridge county, said that although wilder’s support is low in virginia, he appeals to many middle-of-the-road democrats nationally.",1991-1992
"despite wilder’s low approval rating in virginia, carroll agreed it was too early to tell how wilder will do in his run for the democratic nomination.",1991-1992
"‘‘he is trying to present himself as a vice-presidential candidate.”  virginia democratic office holders, including the governor, have traditionally spoken at mock convention, according to mc political chairman jamie tucker.",1991-1992
the 31-year-old democratic candidate said he doesn’t even care who people vote for.,1991-1992
"‘if he were really running, he might take votes away from _ other democrats and split the vote,”’ said roper.",1991-1992
"additional performances are scheduled for october 4, 10, 11, and 12 at 8 p.m. reservations may be made by calling 464-7389.  for your extra pieces of furniture  wé&life        the ring-tum phi, september 26, 1991        photo by patrick mccabe, the ring-tum phi  democratic presidential candidate russel hirshon tells senior will thomas about his campaign goals.",1991-1992
"the ‘‘w&l swing” has also been used as the theme song for     cheerleaders on the 1960 squad practice for the next big game                    calyx pre :  john davis, democratic candidate for president, and a w&l graduate in 1892.  a copy of it was even carried into space on the shuttle columbia by u.s. astronaut and w&l graduate g. david low a few years ago.",1991-1992
"deconcini has earned my respect by standing by thomas, despite the fact that his democratic colleagues on the committee seem to want to stop at nothing to derail his nomination.",1991-1992
"throughout the 1970s and ’80s, mroziewicz was an active participant in poland’s democratic movement.",1991-1992
"by missy curtis staff reporter     between 250 and 300 tickets have been sold to couples for saturday’s first-ever mock democratic convention presidential gala ball, according to mc public relations co-chairman talley woolley.",1991-1992
"5, box 379                  703-463-3478        lee hi  lee hi truck stop lee hi trucking lee hi truck parts lee hi wrecker service lee hi wrecker sales lee hi restaurant       bobby berkstresser         1-800-768-lehi  democratic party saturday, november 9th  dinner special chicken cacciatore $11.95     hollins college friday night 9 p.m. 1 a.m.  moody center, tickets $7.00  boy o boy y-not?!",1991-1992
"dukakis will speak for the convention march 6. he was chosen because of his unique position as the 1988 democratic candidate, ted elliot, mc speaker chairman, said.",1991-1992
jesse jackson and several southern democratic senators were invited including south carolina’s emest hollings and georgia’s wyche fowler.,1991-1992
"the ozone hole is expanding, the blue whales are dying, the democratic party seems to be getting organized, and i can’t find my dress socks.",1991-1992
sophomores matt jackson and ben eggleston argue as representatives of the democratic party.,1991-1992
"on earlier shows the group has debated over oliver north’s new book under fire, civil rights, and the politicians vying to become the u.s. democratic presidential candidate.",1991-1992
april — the democrats decide to nominate franklin d. roosevelt as their presidential candidate.,1991-1992
"september —-+ ina desperation move, the democratic party nominates dan quayle for president, hoping to place all blame on him.",1991-1992
"jennifer pittsburgh, pa. — mcfeeley, the speedy delivery  gladwell, ’93, **mr.  man from mr. roger\'s neighborhood, came to my school and brought purple panda with him.”’  alexis walker, ’95, dania, fla.  — ‘i played in the sand in ft. lauderdale with ricky schroeder when i was two when he was on break filming the champ.”’     denise brainard, ’92, hurricane, w.va. — ‘‘i met enos from the dukes of hazard at a monster truck rally.”’        frank moore, ’92, richmond, va. — ‘i hung out with amy carter in \'84 at the democratic convention in minneapolis.",1991-1992
"‘ ; 58 tractable 26 flat floats nov. 9: the first mock democratic convention | §9 useless plant 27 points of time gala with a donkey as special guest, was held in | 60 look for 28 always the warner center 61 stride 29 influence : : 30 verb form nov. 21: marcus miller was suspended by down 31 guide scc.",1991-1992
"he was elected president of costa  rica in 1986. as president, arias pro}  moted development and democracy in  costa rica, propelling the small na|  tion to notoriety as one of the most peaceable, democratic and economically advanced nations in central america.",1991-1992
"‘but we have to get past this hurdle first, and it’s a very important hurdle.”  mc books prominent politicians  by summer brown phi staff reporter  michael dukakis, the 1988 democratic presidential candidate, the rev.",1991-1992
"douglas wilder and the six remaining major democratic candidates, said mc political chairman jamie tucker.",1991-1992
"wilder recently ended his bid for the democratic nomination, saying that virginia’s current budget crisis took precedence over his national campaign.",1991-1992
"other students will be able to sit in the bleachers,  elliott also said new hampshire democratic party chairman chris spirou will speak jan. 23, three weeks before the new hampshire primary.",1991-1992
chris spirou  *the chairman of the new hampshire state democratic party will speak at 8 p.m. in the lenfest center.,1991-1992
‘‘but he couldn’t come because of engagements to register voters for the democratic campaign.”’  elliot said jackson had hoped to arrange a registration drive while in lexington.,1991-1992
elliot said he does not know if any democratic candidates will speak at mc.,1991-1992
"michael dukakis, the 1988 democratic presidential candidate, and former house speaker thomas p. ‘‘tip’’ o’neill have signed contracts to speak at the convention, elliot said.",1991-1992
"this is sese i\'m not garke to speak at your «0% any wey worldé2 wy no@op4 teusts democrats r moo              che ring-tum phi  jason kelley, rick peltz pamela kelley  cathy lopiccolo thomas eisenhauer joshua manning  jay plotkin  francesca kefalas  associate editor news editor  senior copy editor editorial page editor sports editor entertainment editor assignment editor photo editor cartoonist  leigh allen  john simonton whitney swift hal waller  business manager advertising manager circulation manager  the ring-tum phi is published thursdays during the undergraduate school year at washington and lee university, lexington, virginia.",1991-1992
"arias was president of costa rica, a democratic republic with three branches of government, from 1986 to 1990. sandwiched between central american hotbeds nicaragua and panama and stricken with the regional problem of poor communication in rural areas, costa rica is a tough place to serve as president.",1991-1992
‘‘we can leam a lot from each other by debating the issues.”’  jackson said he sees some of the debate focusing on the democratic plans to reclaim the middle class and on their view of the gulf war.,1991-1992
"the curtain is bulging.... the democrats ask for fairness, that the rich pay their fair share of taxes.",1991-1992
he said democrats want to spend more on health and education while taxes decrease.,1991-1992
mario cuomo will speak saturday march 7 at washington and lee’s 1992 mock democratic convention.,1991-1992
"cuomo, the perennially sought-after democratic presidential candidate who recently has been mentioned as a write-in candidate in the new hampshire democratic primary, will deliver the keynote speech at the convention, according to mc speakers chairman ted elliott.",1991-1992
"2p...             counell     friday, march 5  congressmen jim olin (d-va.), buddy darden (d-ga.) and democratic leadership ouncil chairman alfrom,  mock convention speakers lineup saturday, march 6 10:30 a.m.  new york governor maria cuomo                             state kills latest bill on car tax  by leigh allen        phi staff reporter  a bill that would have killed | proposed lexington’s tax | law would on student cars | have spared a. aan =.",1991-1992
it lends an aura of legitimacy to a totally corrupt and undemocratic system.,1991-1992
"will speak at that session, as well as democratic leadership chairman al from.",1991-1992
"on the lighter side of mc ’92  let it ride     by chris swann  mock convention: booze, ticker tape and democrats.",1991-1992
"who would’ve pictured it at w&l (the booze, not the democrats, that is)?",1991-1992
"being like most of you, and deeply concerned with politics, the democratic party and election day, i have volunteered my time and effort to lend whatever help i could to mock convention.",1991-1992
"this is especially well, we\'ve got true of democratic state dukakis, tip chairmen or, more specifi cally, of their secretaries.",1991-1992
"i am a member of the texas political committee, and as such i have spent innumerable hours (three) on the phone to a state in which i have never set foot so i can ask the executive director of the texas democratic party exactly what he thinks of paul tsongas.",1991-1992
"i\'d like to talk to mr. slagle about the democratic — yes, i\'ll hold.”  ‘‘and he said l.l.",1991-1992
"the ring-tum phi post office box 899 lexington, virginia  24450     exercise your right to vote  to the editor: i must disagree with mr. mackenzie’s  to the corrupt nature of our democratic system and government.",1991-1992
"the employees became ill after breathing  washington and lee university  lexington, virginia     deleg  d-day nears  democrats’ eyes turn toward w&l     trevor norris, rick barksdale and craig lang build a model plane for the lowa state ation’s mock convention parade float yesterday.",1991-1992
"““‘we are educating young people who live both private and public lives in a democratic society, a central tenet of which is freedom of speech.",1991-1992
"he explained that after nebraska sen. bob kerrey dropped out of the race, many state chairmen were advised by democratic officials in their states to shift their delegates from kerrey to clin not all states were allowed to change their  “i was definitely surprised it went on one ballot,’’ said john donaldson, mc administrative chairman.",1991-1992
"if this is true, the democrats cannot afford to nominate a candidate with such an uncertain background.",1991-1992
"as tip o’neill said this weekend, ‘‘paul ... portrays decency and honesty to the american people.”’  yet tsongas is another greek democrat from massachusetts.",1991-1992
"snorkel, homer  in the spirit of mock democratic convention, the university is taking a new approach to solving the car tax problem.",1991-1992
"‘‘we are educating young people who will live both private and public lives in a democratic society, a central tenet of which is freedom of speech,’’ ides says.",1991-1992
"paul goldman, virginia democratic party chairman — ‘1’d be embarrassed.",1991-1992
"‘‘i went on stage assuming that this was the real democratic convention,”’  rumors that cuomo might use the appearance to enter the presidential race just in time for super tuesday did not come true.",1991-1992
"‘‘we need a whole plan, a real, effective economic growth strategy based on inclusion, not exclusion.’’  cuomo called for a democratic agenda based on health care, job training, family leave for women.",1991-1992
"‘‘as in 1932, the democrats will lead us out of it, away from the cliff.",1991-1992
"platform committee member todd ammermann proposed in his minority ° report, which also passed easily, the same 13-percent flat tax espoused by democratic candidate jerry brown.",1991-1992
"democratic party chairman paul goldman even invited students to ‘‘come down and talk to     photo by teresa williams, the ring-tum phi virginia delegates whoop it up after the balloting.",1991-1992
"u.s. representative jim olin, d-va., got a laugh when he beg2n his speech by addressing the crowd as “fellow democrats....’’  shoe fixers  3 w. nelson st., lexington  464-6666  instant shoe repair half soles in 45 min/satir: shoes dyed in 1 hr.",1991-1992
‘so for now let’s all be democrats.”’  goldman said after his speech that he hoped dealing with the issues would cause some students to switch parties.,1991-1992
"“i hope there will be more democrats leaving than there were entering,’’ he said.",1991-1992
"we, the proletariat, are incensed by young mr. mackenzie’s consistent, insidious bashing of the democratic system, a system of which we are justifiably proud.",1991-1992
"and citizens of undemocratic countries, when given the choice, invariably choose democracy.",1991-1992
but let us also remember that in totalitarian states the press is controlled as an organ of government and that in democratic societies the press is free so it may serve the public.,1991-1992
"while he still serves as senior consultant to democratic party leaders, he is now a visiting professor at georgetown university.",1991-1992
"or, as ticos hope, will costa ., ,  rica solve its long-range problems and meet its ~ constitutional aims, within a democratic framework, to become a shining example to the rest of the globe?",1991-1992
"fancy dress and the mock democratic convention both ran under budget this year, with fd making $7,700 and mc returning the $14,000 the executive  committee allotted them in the fall.",1991-1992
"despite only being a freshman, corwin was involved in young democrats, the washington state mock convention delegation and hillel, the jewish students’ organization.",1991-1992
"for double rent, of course; he’s a democrat.",1991-1992
"this has made it increasingly difdecree, and simpson’s support of it, bring to the good students who are interestplease call mrs. rogers at the democratic candidates for president, would be a ficult to provide the number of voices necessary to fore two questions: to what extent will students’ ed in being trained as projecred house, 463-8936. mortal sin and would cause one to “go to hell,” sustain an all-male chorus.",1991-1992
economic vigor and its absence can  today\'people feel more george will help democrats.,1992-1993
