the democratic party\'s change of mind — its movement toward the center — reﬂects recognition that it cannot win the presidency by changing the composition of the electorate.,1992-1993
"your argument for a second term is: hey don’t blame me, i couldn\'t deal with a democratic congress.",1992-1993
"there will be a meeting of the college democrats sunday, sept. 27 at 7 p.m. in room 109 of the university center.",1992-1993
"his race for a senate seat from illinois was supposed to be against the incumbent, democrat alan dixon, an ideologically shapeless career politician vulnerable to today\'s anti-iricumbent fever.",1992-1993
but they do not dislike democrats.,1992-1993
today most downstaters are represented by democratic majorities in both houses of the state legislature.,1992-1993
"since the democrats’ riotous convention of 1968, no democratic presidential candidate has won a majority of votes in the city and its suburbs.",1992-1993
(it voted against two southern democrats wilson in 1916 and carter in 1976.),1992-1993
"there will be a meeting of the college democrats sunday, sept. 27 at 7 p.m. in room 109 of the university center.",1992-1993
miles said musselwhite is the favorite in the race because democrats have held the seat for the past 20 years.,1992-1993
a democratic state legislator scoffed at the idea that the impending tax increase—the largest in the history of any state—would cause businesses to ﬂee california.,1992-1993
college dems  there will be a college democrats meeting this sunday oct. 4 at 7 pm.,1992-1993
"the commission traces the pedigree of its idea back three centuries to thomas hobbes: “it is fairer to tax people on what they extract from the economy,  as roughly measured by their consumption, than to tax them on what they produce for the economy, as roughly measured by their income.” ""  unfortunately, the democratic party, which will control congress for the foreseeable future and probably the executive branch for at least four years, is in an intellectual rut.",1992-1993
"the sixth district, which includes lexington, buena vista, and rockbridge county, is currently represented by democrat jim olin who is not seeking reelection.",1992-1993
"‘college dems  there will be a college ‘democrats meeting this sunday, oct. 11 at 7 p.m. in the university center room 109. for more information call cottie miles at 464-6133.  film society  there will be an organizational meeting of the w&l ﬁlm society on thursday, oct. 8 at 7 p.m. in the commerce school room 221. all who wish to be involved with the film society this year should attend.",1992-1993
college democrat president cottie miles said his organization will set up phone banks in november to call registered voters and encourage them to vote.,1992-1993
"the college democrats will attend rallies at the capitol and at the university of richmond, miles said.",1992-1993
"collegedems  there will be a meeting of the collegedemocrats this sunday, oct. 18 at 7 p.m. in the university center game room.",1992-1993
"2. the cold  campaign backing the democratic presidential candidate because of homefront concerns like education, health, workplace policy, and, in many cases, abor tion.",1992-1993
"college dems  there will be a meeting of the college democrats this sunday, oct. 25 at 7 p.m. in the university center game room.",1992-1993
"members of college democrats will meet at a member’s apartment to watch the returns, president cottie miles said.",1992-1993
is the self-styled ‘ ‘different sort of democrat” the genuine article or merely a masked man grabbing for  more rocky mountain votes  christopher matthews tribune media services  than he deserves?,1992-1993
"does he intend to steer an independent course, or dance to the tune of the interest groups who anticipate the democrat’s arrival in washington as a groom awaits his bride on their wedding night?",1992-1993
"to many observers, this one included, the dlc ’s challenge to the old democratic establishment  —was more than a shift rightward.",1992-1993
"it was  a rescue operation, a bold campaign to free democratic candidates from the clutches of the interest groups: the teachers who claim imperial control over education policy, the labor unions who seek to dictate trade policy — whatever the impact on consumers, the fat-cat contributors who treat foreign policy as a bidding war.",1992-1993
"furthermore, the democratic party is suffused with sympathy for the doctrine of group rights.",1992-1993
"because of the ideology of victimization, it is improbable that a democratic president will talk fonhrightly about the crisis of character in those portions of the american community that are being destroyed by bad behavior — crime, drug abuse, irresponsible procreation.",1992-1993
"college dems  there _will be a meeting of the college democrats this sunday, nov. 1 at 7 p.m. in the university center game room.",1992-1993
"“but i tell ya, watch your wallet!”  miles presented a democratic platform that included a national  health care system, pro-choice legislation, increased employment through a better education system and education on drugs rather than interdictron.",1992-1993
"and the democrats say, “‘give me your money and let us solve your problems.”  “libertarians believe you can have your money and solve your own problems,” he said.",1992-1993
"among the spectators at the ghq was the wife of democrat steve musselwhite, the congressional contender from virginia’s sixth district.",1992-1993
"college democrats president cottie miles said that with the election over, it is time for americans to work together.",1992-1993
"college dems  there will be a meeting of the college democrats this sunday, nov. 8 at 7 p.m. in the university center game room.",1992-1993
"the likely suspects are those same, feet-on-theground folk who helped  right.’     ‘he ran an outstanding campaign,’ dan quayle said of the democratic presidentelect.",1992-1993
"“herananoutstanding carnpaign,”dan quayle said of the democratic president-elect.",1992-1993
"~ ~ ,;,_.,:.\'  \' ing buslritslleader.“ ’  democrats are government enthusiasts: they are unsu\'re what justice is, but are sure that only government can deliver it.",1992-1993
"weinberger has devoted much of his life, in both california and washington, to the good work of democratic government.",1992-1993
"the ring-tum phi post office box 899 lexington, virginia  24450  gop gears-up for wild rideiofthe future‘  washington — democrats dispensing jobs are fending off phone calls from hundreds of people who claim to have sat next to them in third grade.",1992-1993
"ehation of america’s  diversity with arts and  crafts and things,” col lege democrats president cottie miles said.",1992-1993
"miles said about 15 college democrats will travel to washington tuesday to witness the inau‘guration ceremony and participate in activities surrounding it, miles said.",1992-1993
"the ring-tum phl, january 14, 1 993                               democrats breaking promises already   washington —— during the campaign democrats promised “change,” perhaps assuming that “change” is a synonym for “progress.” during the transition they have proven that it is not.",1992-1993
"although 27 honorable democrats broke ranks, the bovine herd of the other democrats was large enough to pass the measure giving virtually full voting rights to the delegates from samoa, guam, the virgin islands, puerto rico and the district of columbia.",1992-1993
"the senate’s democratic leadership has made former senator wyche fowler, the georgiadernocratdefeated in november, a $130,000-a-year “special deputy” to the federal election commission.",1992-1993
democrats believe the fec should have ordered the gop to curtail its spending during the november nin-off campaign that fowler lost.,1992-1993
"”), was hardly the only example of the house democrats’ growing arrogance of power.",1992-1993
"worse, house democrats, whose party traces its pedigree back to jefferson, have jettisoned the principle that a committee “can only act when together,” a principle whose pedigree rims back to jefferson ’s manual of parliamentary practice.",1992-1993
"chairmen —— they are all democrats, of course —— can even be oneperson quorums after enough members have passed through the committees’ rooms.",1992-1993
"what made carville and begala unique was: 1) their ability to attract middle-class voters to  their democratic clients; and  2) a winning track record marked by fresh victo ries in kentucky, georgia and new jersey, plus a  l string of wins in pennsylvania capped by democrat harris wofford’s come-from-behind upset of u.s. attorney general dick thombuigh in a 1991 u.s.  senate race.",1992-1993
"but panetta is also a democrat with the proven talent for convincing a middle-class, socially diverse constituency that he  another impressive politician.",1992-1993
"as chairman of the democratic national committee, brown got the twowinged party to ﬂy a winning course the last 12  months.",1992-1993
"to run the best possible campaign, the young arkansas governorquite simply hired the best in the business....  asked to do the same: keep down-and-out democrats  ’80s; also, keep the new president aware of what folksinthe neighborhoods are saying and feeling.",1992-1993
"in 1988-, a’ very wise democrat, before a single delegate was chosen, looking at the way they’d been losing elections for generations, including in the south and the west, said that the democratic nonrinee ought to be part horace greeley and part u.s. grant: someone who could go west and capture the  south.",1992-1993
"jimmy carter, the last democrat to sit at the big desk in the oval office, delayed biting the bullet on doubledigit inﬂation until his last year i!",1992-1993
he must leave the govemorship in 1994. democratic sen. fritz hollings was just re-elected as soutl9 carolina’s junior senator — junior although in his’ 27th year in the senate.,1992-1993
"william jennings bryan took the democratic party down to defeat three times, but in the process he  jackson — the most truculent president — now that \' v_  it has been determined that jackson’s birthplace was, at the time, on the south carolina side of the border (subsequently adjusted southward) with north carolina.",1992-1993
“unrealistic” is now the word from panctta’s former democratic colleagues in congress.,1992-1993
"that is what “new democrats,” like old ones, do: they try to micromanage an economy moved by billions of private decisions daily.",1992-1993
the loudly trumpeted first fruit of democratic’ hegemony over both political branches of the govemment is the family and medical leave act.,1992-1993
is off to a ﬂying start at fulfilling the traditional destinies of old-fashioned democrats.,1992-1993
"‘new democrats” didn\'t com © 1993 washington post writers group  letters "" student praises sally mann feature sally mann’s work can no more be garden °f ede“ than anﬁhing 5159a judge such a delicate issue?",1992-1993
democrats  college democrats will meet feb. 28 at 7 p.m. in the university center game room.,1992-1993
the president and his democratic leadership council have pledged to the american people that the new administration will bring an end to traditional politics.,1992-1993
"i  racasa  windfall, a folk music group from the shenandoah valley, will perform a beneﬁt concert for the blue ridge sexual assault center saturday, feb. 27 at 8 p.m. at mary baldwin college in staunton, va. for additional information, call 703-885-7273.  democrats  there will be an important college democrats meeting sunday, feb. 28 at 7 p.m. in the game room.",1992-1993
"during last year’s campaign, he slammed democratic rival paul tsongas for even proposing such an idea.",1992-1993
"harry twenty-one years after watergate, he truman invited herbert hoover tomeet  was back at the white house, offering his counsel to a democratic president.",1992-1993
-but the democrats with the homely daughters are teaching us all alesson.,1992-1993
the democrats love their daughters for characteristics beyond high cheekbones and straight tumed—up noses.,1992-1993
the democrats value women for their contributions to society — not their ornamental appeal.,1992-1993
‘  the college experience should be a democratic celebration and conﬂict of ideas.,1992-1993
"the third ground would be vote fraud, such as stuffing ballot boxes, rigging voting, registering ineligible voters—-physical acts that assault the integrity of the democratic process.",1992-1993
"when people in our former country understand that their enemy is not any ethnic group or nationality, but the criminals and their leaders on all sides, only then it will be possible to organize together against aggressors (whoever they may be, or whichever nationality they belong to).”  i am concluding with hope that in the future our university will provide more time and space for the people who support democratic process, and represent the only hope for peace, no matter how insignificant they appear to be.",1992-1993
"in wisconsin, democratic state legislator polly williams pushed through legislation that gave part of milwaukee a voucher system.",1993-1994
"other cvmatch-ups planned, one every friday, includethecollegerepvub~ iicans versus the college  , democrats, jubilee versus v southern comfort, “all the , real rivalries on campus,” ‘  .",1993-1994
"throughout its recent history, were on a mission to aid haiti in returning to a democratic m magyland southern northern western _ “th?-_snw¢y has atwftys been some’; washington & _1-ce has steadily f133’ ed \' goverment from a military dictatorship.",1993-1994
"i believed strongly the defense of free speech, no matter how offensive, is necessary to ensure a democratic society.",1993-1994
i have nothing against the free discourse of ideas in a free and democratic society.,1993-1994
lt’s not even safe to  nominate anyone either non-white or female without the label  i have nothing against the free discourse of ideas in a free i and democratic society.,1993-1994
"as members of the educated elite, w&l students should not only care but be actively engaged in the whole democratic process.",1993-1994
allen predicts smooth transition  govemor-elect george allen said he and governor douglas wilder will work closely in order to ensure a smooth transition after 12 years of democratic control.,1993-1994
allen pummeled democrat mary sue terry in elections on tuesday.,1993-1994
allen said he anticipates few problems in getting his programs through the democrat-controlled general assembly.,1993-1994
"ing democratic nation, to reboth boys should be exm ’ consider its position on this isecuted or,“fried,”asone ’94 sue.",1993-1994
"they feel the families of the victims need to know someone else  perhaps it is time for our nation, the world’s leading democratic nation, to reconsider its  if it has been proven to the wrong solution.",1993-1994
"v  democrats  the college democrats will hold elections on sunday, nov. 14, 1993 at 7:30 p.m. in the university center game room.",1993-1994
"wilder’s withdrawal was a surprise, and means that there will be no november ﬁreworks between wilder and his longtime archrival, incumbent democrat charles robb.",1993-1994
north will run for democrat charles s. robb’s seat.,1993-1994
poll shows north lacks support  a new poll shows that almost any democrat could defeat oliver north in the race for a u.s. senate seat.,1993-1994
charles s. robb is favored to win the democratic nomination.,1993-1994
"now the questions turn to his chances of both winning the nomination of his party and  the seat itself, presently held by democrat chuck robb.",1993-1994
"although i am a “die-hard” democrat, l have faith that  although i am a “die-har ” democrat, i have faith that the reasonable members of the grand old party see mr. north much as i do, not as the voice of their party but as a political opportunist.",1993-1994
"“he’d look like he’d be asleep, and then he’d look around and say the most intelligent things.”  though litz was involved in several activities, including habitat for humanity, the college democrats, the phi alpha delta law fraternity and his church choir, friends said he always had time for them.",1993-1994
"the ring-t um phi reported on february 18, 1969, that senator george mcgovern, a democrat from south dakota, spoke before a crowd of more than 600 in bee chapel.",1993-1994
"ashmore, who is also a former director of the center for the study of democratic institutions in santa barbara, calif., has been an active proponent of the civil rights throughout his public and journalistic career.",1993-1994
"following a distinguished journalistic career as editor f the arkansas gazette, and before that the charlotte news in north carolina, ashmore became afﬁliated with the center for the study of democratic institutions and other projects launched by robert hutchins, fonner president of the university of chicago and educational gadﬂy.",1993-1994
"the dissenting speaker argued that compulsory birth control was undemocratic, and it would cause an increase in sex delinquency by interfering with the normal human habit pattern.",1993-1994
"democrats    the college democrats will be conducting a seminar, “how to deny just about anything with a ’ straight face,” on s‘ugnd_ay at 2 pm.",1993-1994
"actually, it has been a topic on an internet debate on whether or not progressive groups should stage a protest at  the 1996 democratic convention.",1993-1994
"on a personal level, my family are new deal democratsblue-collar unionists.",1993-1994
"i think there is something in the blood that prevents us from voting anything but democratic; so naturally, i don’t want to  turn against the party.",1993-1994
"now for practical reasons, i think many of the problems the group has with the democratic party might not be so prevalent if there were more party loyalty.",1993-1994
"———-’ cérr i“ actually, it has been a topic on an internet debate on whether or not progressive groups should stage a protest at the 1996 democratic convention.",1993-1994
"0  example, during the north amercan free trade agreement debate, was one loyal if you supported nafta along with the president or if you opposed to it along with the majority of democrats in the house and the unions?",1993-1994
", beatings that tookplace at a different democratic convention when a different daley was in office.",1993-1994
"nixon says, “what happened in watergate — the facts, not the myths —— was wrong.”* though nixon denies any prior knowledge of the breakin at the democratic national convention headquarters in june, 1972, on the wider question of his responsibility  ‘for the conduct of his officials, and of  his culpabilityin the cover-up that followed, nixon admits fault, ‘‘...i should have set a higher standard for the conduct of the people who participated in my campaign and in my administration.",1993-1994
"in race matters, come] west, one of today’s leading black intellectuals and currently professor of afr0american studies and the philosophy of religion at harvard university, combines intellect and righeousness in his discussion of a number f topics dealing with race: “plato’s profound ——yet unpersuasive — critique of athenian democracy as inevitabljpcorrupted by the ignorance and passions of the masses posed one challenge, and du bois’s deep analysis of the intransigence of white supremacy in the american democratic experiment posed another.” invariably, west is able to construct a conversation that stimnlates the mind while at the same time stirring the emotions.",1993-1994
"goode cites robb’s personal scandal to boost campaign  state sen. virgil h. goode, jr. warned democratic leaders against nominating us.",1993-1994
"sen charles s. robb for senator, saying his candidacy could hurt their bids for re—election in 1995. goode cited robb’s personal scandals of attending parties where drug use occurred and for behavior “not appropriate for a married man.” goode said the democrats need candidates who can stand up to oliver north in november, and not be phased by negative publicity.",1993-1994
"and often, of course, u.s. policy is a fair reﬂection of this democratic philosophy: u.s. pressure helped to unseat south africa’s minority government, for example, and as we speak american officials are contemplating an invasion of haiti to restore that country’s democratically-elected leader, father aristide, to  power.",1993-1994
"general pinochet made a choice for his people that communism, though in some measure approved democratically by the chilean people, was not tolerable by some higher stan‘ dard; the united states concurred.",1993-1994
robb offers to steal food from widows and orphans  opponents of u.s. senator charles robb are pleased with a recent remark the democratic incumbent made about tax increases.,1994-1995
"we have yet to learn whether a u.s. invasion of haiti could ever achieve its objective of a stable, democratic government there.",1994-1995
"secretary, executive committee  general  notes  democrats  the college democrats will hold their ﬁrst meeting on sunday, sept. 25 at 7 p.m. in the game room of the university center.",1994-1995
"interviews are sept. 28.  robb  college democrats will hold a reception for catherine robb, senator robb’s daughter, wednesday, sept. 28 at 7 p.m. in the fairfax lounge.",1994-1995
"catherine robb, daughter of senator chuck robb and granddaughter of former president lyndon johnson, was the guest of honor at a reception held by the college democrats wednesday  about thirty-ﬁve students came and went during the evening.",1994-1995
"she also predicted that the withdrawal of the independent democratic candidate, former governor.",1994-1995
"“this was the biggest democratic gathering ever, except for mock convention,” said senior andy wright.",1994-1995
",, l a handcuffedtothearmofphi executive lectively known) \' supply has also pr0front (the kind of car you’d expect ’  editor sarah gilbert’s personal bodyuse the cb handle ‘ "" duced 4 series of ﬁre betsy to drive) and on the back will be s eni ors guard), i called virginia hobby supof “wuzzfuzz.” ‘ "" engines trading a list of all the great things about living democrats 7,‘; ply, the company which distributes the they are apparently also happy to make cards, as well as bird and ﬂower cards.",1994-1995
"public on a trading card the fact that all of these consumer choices doesn’t will be blank, so you can write a grocollege democrats will have a t tekast dilmo gav°bset8rsp,‘°\' ‘(fa \\ i spoke with richard matthews, the1rtruck“featuresaerodynamicwheel mean there isn’t room on the market cery list.",1994-1995
democrat charles robb’s campaign last week raised the issue of north not reporting drug trafficking information to authorities.,1994-1995
he said he made sure that a college democrat was always present at the election booth.,1994-1995
of course many of those sup posed to be swept out of ofﬁce are democrats.,1994-1995
the plan emphasizes the establishment of democratic institutions and the rebuilding of the economy with market forces and foreign aid.,1994-1995
"the gop gained 49 representatives, raising their total to 227, compared to the 199 democrats and one independent.",1994-1995
the state  robb defeats north; 10 reps are re-elected  democratic candidate charles robb won election to a second term in the us senate in tuesday’s election.,1994-1995
"big losses for democrat incumbents were house ways and means chairman dan rostenkowski, powerful chairman jack brooks of texas, eighteen-year incumbent jim sasser of tennessee, the most popular texas governor in history, ann richards, and the orator of the left, mario cuomo.",1994-1995
"also mean that \\;\'then....while lh1llary clmton 8 vl~:eil:ls(¢i:,sttl;trfe:psi;li:l£zi£s h full th democrats and re ub icans canaswe .",1994-1995
"i keep up with the news and i read the papers.”  aaron brotlierton ’98, charleston, wv “sure, i\'m just not as active as i’d like to be.”  melba merritt ‘ ’97, radford, va — “yes, i try and keep up with political issues, especially during election years.”  nova clarke ’96, miami, fl “yes, i’m the president of the college democrats.”  professor john m. gunn, wash-\' ington and lee university,retired“yes, i’m an economist by trade and the political scene affects my job.”  tx “no, i haven’t watched the -news since i’ve been here.”     the ring-tum phi, november 11, 1994  opinion  page 8  new mailboxes installed, will increase campus communication  letters  to the editor:  i want to take this time and space to infrom the w&l community about the new mail boxes for all clubs and organizations which are located outside of my office, room 103 of the university center.",1994-1995
"i fsumiv day...cha$ul’ me cioops a-um;  {/33  now that that bul  office work‘: outta the  way, i can sit back and watch sorne ”c°0n51                                ry           defeats will strengthen democrats in ’96     i don’t know how many times last wednesday i was asked why i wasn’t dressed in black.",1994-1995
i guess the common assumption was that i should be mourning the loss of democratic control of congress.,1994-1995
"besides, people wear black to funerals, the end of a life and the democratic party is far from dead -just momentarily stunned.",1994-1995
"the people spoke and a lot of democrats lost their seats, including  some who have been around since  before i was born.",1994-1995
