"second, i think  the democratic party has been too complacent.",1994-1995
"after all it’s been forty years that we’ve controlled the house, and the election of a democratic president made us too cocky.",1994-1995
"to accomplish anything they are going to have to learn how to compromise, within the party as well as with democrats.",1994-1995
"i think this election is good for the democrats, in that now the party is going to have to releam offensive skills.",1994-1995
the democrats are going to have to figure out who they need to win and whether there is a possibility of bringing them into the fold without alienating other groups.,1994-1995
"obstructing and the election of“ the main g o v e r n . . way the mem, we democratic president 61, ct i 0 n are tngt made us too cocky.",1994-1995
"a while lh)e1ped the going 0 e o emocra s backin’96, in the mlryorlty may  is that if put i yould us consolidate as a party, gothinggets ovc 0 s66 ° \' one, i b 0 b teach us a little offensive cannot be g ra n a m play, and even beneﬁt us biamed on filibusterin ’96_ the inaction ing by of the readin the democrats.",1994-1995
had remained with the democrats and  this is also a chance for the democrats to re-evaluate their voter base.,1994-1995
"there was no set rule for who won on tuesday, but moving to the right did not seem to help some democratic congressmen who lost.",1994-1995
"the time has come to make ann richards chair of the democratic     d  a  tried to pretend it wouldn’t matter, but i think it’s time to face facts.",1994-1995
"in the background, beyond all the pomp and circumstance and the almost all nighter they pulled on the first day of the new session are some questions posed by, among others, the democrats in congress and constitutional scholars.",1994-1995
"the state  democrats criticizeallen’s proposed cuts  several democratic budget-makers blasted allen administration ofﬁcials, charging that governor george allen is paying for his proposed tax cuts by borrowing money for prison construction.",1994-1995
general assembly democrats seem likely to kill or change the budget.,1994-1995
allen said he will ﬁght the democrats plans to kill his budget and tax-cut initiatives over breakfast in the executive mansion.,1994-1995
"as always, the battlefield of ideas awaits’ a brave recruit...  dnc must be rebuilt from grassroots up  nova clarke, ’96     as some of you may know, the democratic national committee has just appointed christopher dodd, a connecticut senator, as general chair of the dnc, and don fowler of south carolina as national chairman.",1994-1995
this is an important asset in managing the various factions and egos within the democratic party.,1994-1995
both of these qualities are  necessary for the democrats not to be totally wiped out of the picture in 1996. an article deﬁned him as a ‘visceral’ democrat.,1994-1995
one definitions of visceral is “proceeding from instinctive rather than intellectual motivation.” i can hear the groan now; democrats acting from the heart and soul instead of from the brain is precisely what got this country into trouble.,1994-1995
they weren ’t democrats because that is the party they could win the election with.,1994-1995
they were democrats because that is the party  they felt a connection to.,1994-1995
"as a democrat, i can totally understand this sentiment.",1994-1995
"there is great appeal for me to abandon the democratic party for the green party, whose speciﬁc policies and goals are more in line with my ideals.",1994-1995
"a larger part of me, however, is attached to the democratic party.",1994-1995
my mother’s family has always voted democratic.,1994-1995
"personally, i would like to see the democrats articulate some  lican.",1994-1995
"if she doesn’t approve of the democrat, she votes for the  (c  positive goals.",1994-1995
democrats are left senate race.,1994-1995
another democrat stated it even better.,1994-1995
"senator barbara mikulski, in an editorial in the washington post said, “democrats must figure out what works.",1994-1995
we must be advocates for people and not automatically defend every government program.”  another thing that democrats must realize is that people are alienated when they think politicians are basing their actions purely on the calculation of their re-election chances.,1994-1995
"when asked what the democratic party stands for, i often respond with what i wish it would stand for, since what it stands for is not really known.",1994-1995
v. statedemocratic party.,1994-1995
"some of her ideas that were vilified as anti-democratic were simply a way of describing positive-sum games in electing representatives, she said.",1994-1995
the fate of the amendment in the senate will be decided by sen. sam nunn of georgia and four other democrats who have threatened to oppose the amendment if it is not revised to prohibit the courts from interfering with future congressional tax and budget measures.,1994-1995
"with questions of guilt or  sexist traditions must be re-thought     i have decided to shed my democratic tag for a while and write about women; not democratic women"" but women in general.",1994-1995
"_ 2.904 there are only three openly gay congressmen in the 2.888 house of representatives now: barney frank and gerry 2 3 7 3 studds, both massachusetts democrats, and steve gunderson .",1994-1995
"‘ _ _ the thrust of tafel’s message is of inclusion, education  and political activism by gays and lesbians, not just in the  democratic party.",1994-1995
"the gay community was in a bind as to which candidate to support: john silber, democrat and president of boston university, who had made disparaging remarks about gays and lesbians as well as women, or william weld, a former u.s. attorney and reagan justice department official, who  see tafel, page 8     beyond the blue ridge  ukraine demands new power plant  on monday, ofﬁcials in kiev, ukraine changed their position on the status of the chernobyl nuclear power plant.",1994-1995
"mock convention will also sponsor former reagan assistant to the president for political and intergovernmental affairs frank j. donatelli’s speech thursday, april 27 at 8 p.m.  a cookout will be held in the baker-davis-gilliam quad from 5:30-6:30 p.m. friday, april 28.  polish economist  leszek balcerowicz, professor of economics at the warsaw school of economics, wiegand distinguished visiting professor in democratization at georgetown university, chairman of the political party freedom union and former deputy prime minister and minister of finance of non—communist poland, will speak on “understanding post-communist transitions” in commerce school room 221 may 1 at 3 p.m.  women’s center  the women’s center suite 305 in gaines hall is available to any women who wish to use it.",1994-1995
tafel feels that the gay community’s tendency to put all of their political eggs in one  (democratic) basket has resulted in a marginalization of gay activists in politics.,1994-1995
"for more information, call 463-7103.  polish economist  leszek balcerowicz, professor of economics at the warsaw school of economics, wiegand distinguished visiting professor in democratization at georgetown university, chairman of the political party freedom union and former deputy prime minister and minister of ﬁnance of non-communist poland, will speak on “understanding post-communist transitions” in commerce school room 221 may 1m3om  road & river relay  the twentieth annual lexington road and river relay will be held may 6. the relay is for teams of five or fewer.",1994-1995
it is also believed that falcone was expected to expose links between the sicilian maﬁa and italy’s christian democrat led political regime.,1994-1995
woodrum enters race  roanoke democrat del.,1994-1995
"questions should be directed to lucy at 463-4121.  college democrats  students interested in working on local campaigns and helping the democrats hold virginia are invited to the college democrats meeting at 6:30 p.m. tuesday, sept. 26 in the gameroom.",1995-1996
"tions agreed to establish a joint parliament and presidency, and democratic elections in their culturally divided nation.",1995-1996
college democrats ‘  editor\'s note: this is the last of a three-part series  highlighting different political organizations on campus.,1995-1996
by cerissng rasmussian at one of the meetings the campaign manager for the phi staff wmer local democratic virginia delegate candidate spoke to the group which hopes to get involved in the local ’ virginia state elections as well.,1995-1996
"rounding out the list of campus political organibesides the president, the college democrats’ zations is the college democrats.",1995-1996
college democrats to contact her.,1995-1996
"one might think that such a laudable proposal would draw support from democrats, or at least substantive debate over the changes in medicare.",1995-1996
watching the democrats during the four hours of debate on the medicare proposal was like listening to the proverbial johnny one-note banging away at his piano keyboard.,1995-1996
"comparing the day to pearl harbor, democrats shamelessly repeated the mantra “tax cuts for the rich” more than 100 times in just over three hours in an unabashed at tempt to provoke class envy at the expense of honesty.",1995-1996
the fact is that these “contract with america” tax cuts are merely the ﬁrst step in setting right the past wrongs of the 40-year reign of tax-and-spend house democrats.,1995-1996
"coincidentally, he happened to reveal this gem at a democratic political fundraiser for the wealthy.",1995-1996
"the single biggest element of the tax-cut package is the $500 per child family tax credit, a step toward restoring the value of the dependent deduction that has fallen woefully behind inﬂation under the democratic congresses of yesteryear.",1995-1996
the irresponsibility and shameless fearmongering and d e in a g o g u e r y that congressional democrats have been reduced to is clearly  an uninformed public.,1995-1996
"in the face of a crisis this large, democrats have resorted to morally bankrupt political posturing.",1995-1996
"for one thing, lam no longer a member of the college democrats.",1995-1996
"he also agrees ffwashifnggjon, dd.c.—iqllgressional ii1v8stliga[loi\'l into the damaging end» that faith in god was supported by the ° “\'5 ° 3 mm“ sp3’ rich am“, in“) vemem in cia °p°”‘u°n5 though the democratic party has founding fathers of the country.",1995-1996
"while deutch maintains that the blame for the heenexnloitedbv the democratic party_ called 3 seihout, an uncle tom and a catastrophe cannot be placed on the directors during that period, he is jeffbl-own’director-ofcl-ass roots wanha-he boy by other blacks, taking steps to reestablish the cia’s image, which has suffered considerdevelopment for the virginia repubhe is often asked why he is a re,7 ably since the extent of its failures has been revealed.",1995-1996
"the democratic party,” he said.",1995-1996
". . “there were four things that kept though they need the black vote, quebec separatlst nlovernent slaves on the plantation: dependence, artissaid, democrats recognize blacks .. .. . . .. a i ignorance, fear and race.",1995-1996
"accept its “serof the democratic everpayment “deems vices” and desocial-contract a ro riate_ mands whatever philosophers,  p payment it such as john deemsappropriate.",1995-1996
"unless the court actually says otherwise, we must govern ourselves democratically and choose our own moral codes.”  women’s $wlmmlng  rips padford 6  by darcey livingston phi staff writer  where in the world is todd matthew rehm?",1995-1996
"2. vote democratic, 3. insist on taking naps in lee chapel, next to the statue of lee.",1995-1996
",  he believes in the principle that journalists are the catalyst in the democratic system — they help the process along, but have no measure, influence on the result.",1995-1996
"there was no way democratic senators were going to vote against an african—american successortothurgood marshall, denniston said.",1995-1996
"w&l seniors  cindy  is the essence of thedemocratic tradition, he said.-: a  .",1995-1996
"..t;id,th_ t;eae11’generation has to renew democrat’  “if yodthittk jyoti can rmiddle through it, you lose it.”  v ’ americans must deal with the issue, of race.",1995-1996
but there is cause for hope: the democratic desire to do better.,1995-1996
"“but democrats are so much cooler,” they say, and usually cite x and y rock band and our sax-sporting president.",1995-1996
"indeed, only o’rourke could ex plain the s&l crisis in 15 minutes, relate the omnibus farm bill to the artiﬁcial insemination of cows, and compare life under the democrats to a visit to the department of motor vehicles.",1995-1996
"the washington and lee mock convention has been a university tradition since 1908. inspired by the visit of william jennings bryan to the campus, a group of students decided to hold a mock presidential convention patterned after the democratic convention that would be held that summer in denver.",1995-1996
"one of the most popular and influential democratsofhis time, the 78 year-old barkley was known as the “old ﬁre—horse.”  minutes later barkley’s death would thrust w&l into the national political spotlight more than ever before, with his final words, abiblical quotation, ringing in its ears.",1995-1996
"celebrate coeducation  he said...  “better coeds than deadheads.” --banner at the 1984 mock democratic convention  “most girls are going to enroll here becaue this is where the boys are.”  --w&l professor  “women are the most beautiful things god put on earth, but they’re so much messier than men.”  --big “john” alexander w&l custodian.",1995-1996
"as taiwan embarks upon its ﬁrst democratic elections, china has betsy gm"", phiphoto edna, increased its threats against the democratic separatist regime in taiwan.",1995-1996
"almost a week ago, taiwanese voters returned president lee teng-hui to ofﬁce with a landslide 54% majority in a historic election that marked the first time there has been a directly-elected democratic leader in chinese history.",1995-1996
"it has continued to crack down on democratic dissidents inside china, and  (c the chinese have happily ignored u.s. concerns and warnings,secureintheimpression that they face a weakpresident whose foreign policy allows them to get    dignity?",1995-1996
"and in what may be one of the  most ironic stories of 1996, pro‘i ‘life‘democrats are mounting their \' own ‘challenge toitheir \'party”s\' ex treme pro-choice platform ‘plank.",1996-1997
"you may remember at the time of debate, democrats in congress trumpeted the measure, saying that it would finally give struggling americans a“living wage.” (never mind that in the two years in which they controlled congress and the white house, they never saw the need to “help” americans in this  way.)",1996-1997
"on the left will be laura knapp, ’97, our new democratic columnist.",1996-1997
"on the left will be laura knapp, ’97, our democratic  columnist.",1996-1997
"on the left will be laura knapp, ’97, our democratic columnist.",1996-1997
"face, a family and a problem that  democrats have felt that the gov grams all start out with good inten from the right jason zacher ’98  the ring-tum phi editorial editor  one of the first debates ourforefathers had when creating our country was, “how large should our federal government be?” being the wise men that they were, the federal government (under our current constitution) was started as a small entity given a few speciﬁc duties.",1996-1997
some democrats argue that we need to provide for people who cannot provide for themselves.,1996-1997
our democratic columnist.,1996-1997
"on the left will be laura knapp ’99, our democratic columnist.",1996-1997
nixon was elected by voters that were growing tired of democratic bunglings in vietnam.,1996-1997
"supported by practically all of the gop majority and a large portion of the democrats, the amendment is almost assured passage.",1996-1997
"well, if a  democraticpresidentholdsthe white house, you guessed it: medicare and medicaid.",1996-1997
"philosopher speaks on ethics:  4 this year’s fishback visiting writer, jean bethke elshtain, will present a talk on “the crisis of democratic authority” on thursday in lee chapel.",1996-1997
"—compiled by peggy srumz  the prize was established by the w&l faculty to honor  people’s liberation army, will hold an hour-long brown bag  applications for orientation group leaders for the class of  “f o p i n i o n from the right looks at the democratic fundraising scandal.",1996-1997
"the democratic campaign money scandal is a complex weave of people, corporations and countries.",1996-1997
"another democratic fund-raiser, mark middleton, solicited a $15 million contribution in 1995 from liu taiying, chief financial officer for taiwan’s kuomintang party.",1996-1997
popinion  who are the winners and the losers in the democratic fundraising scandal.,1996-1997
the democrats’ fund raising scandal supplies some interesting winners.,1996-1997
"the story thus far:  the democratic national committee engaged in questionable, and possibly illegal, fund raising activities.",1996-1997
the democrats could lose the congressional seats they gained in the 1996 election.,1996-1997
"ofcourse, your friend might be one of those people who can handle large amounts ofalcohol without showing any signs ofdrunkcnness (slurring ofspcech, troublewalking, voting democratic,ctc.",1996-1997
democrats are not the only ones  at fault in the fund raising scandal.,1996-1997
"theodore sorensen, in “why i am a democrat,” states it best: “what a tragedy that the.world’s leading democracy features the \\vorld’s mostexpensive political campaign system, requiring most candidates in both parties to spend a majority of their campaign hours not discussing or studying issues, but participating in a process that inher “it has become clear that the time has some for chance on both ends of the mall, both the executive and legislative branches.",1996-1997
the fund for public interest fers an opportunity to get inlved in the democratic proqs and to make bucket loads \' money.,1996-1997
"a few years ago, the democrats had no  trouble “hurting” military families and 1  defense contractors’ families by closing military bases all over the country and slashing the size ofthe military.",1996-1997
"almost everyone (except for a few democrats) knows that someone has to be affected by budget cuts, but nobody wants it to be them.",1996-1997
the college democrats provide a forum for discussing the best way to ruin everyone’s future with idiotic social programs.,1997-1998
the 258-176 vote in the house was largely along party lines with only 3 1 democrats bucking the tide to begin hearings.,1998-1999
"“we’re a national school, and i  think that kind of hurts us,” said young democrats president jason hahn.",1998-1999
"pro,,eiithat as third     ’ \' ineiitly as?-tth,§.i.democrats’,and  \' .§pb.kesmai!§isai<i;:                    x, polio..announce ‘ omebae ‘    _   idesartenheir jcateers.wer¢e::ded ;.",1998-1999
"i don’t know if it could have been done any better.”  bicenquenquagenary ball swings wonderfully  his date to the music of chairmen of the board during the p y students agreed that the ball was an amazing success, including 250\'“ mandy stallard and the steering committee worked so  photo y llister hoey/exertive eitr  peter hart dissects election ’98  by polly doig  news editor  “ten percent of americans think that pollsters can predict the future  that puts us well ahead of the ouija board and the magic 8 ball.”  so spoke democratic pollster peter hart during a lecture that analyzed the 1998 election at washington and lee university last week.",1998-1999
"and tumout, according to hart, was the most important factor for democrats in the  1998 election.",1998-1999
he cited an increased numberof minorities and union-aﬂiliated workers as crucial to the democrats ability to hang on.,1998-1999
"“the single most important thing in democratic society is voting  the most important thing in an election is who’s going to vote,” said hart.",1998-1999
"finally, students are very willing to consider some significant  3 changes to our current plan —es pecially if they are viewed as increasing the democratic nature of our system.",1998-1999
‘ \' 1\' ‘e  l n i  most democrats do not even dispute the fact that the president lied under oath in his jan. 17 deposition in the paula jones case and in his grand jury testimony seven months later.,1998-1999
the democrats’ proposed~national health plan reeks of socialism; it would effectively limit the choices that an employee has in choosing a doctor.,1998-1999
a majority of students voting for one or the other is the democratic answer.,1999-2000
"photo courtesy ley burn library special collections  delegates at the 1972 democratic mock convention committed a rare error, and mistakenly nominated sen. edward m. kennedy.",1999-2000
": members of the alabama delegation get rowdy with the excitement of mock convention 1960. the convention correctly predicted john f. kennedy, jr. as the democratic party’s nominee.",1999-2000
"students decided to hold a mock democratic convention, in which they elected bryan as the democratic candidate —~ a vote that was then repeated  at the democratic national convention, starting w&l off on its prestigious political prediction path.",1999-2000
the essence of a democratic republic is the active participation of informed persons in their government.,1999-2000
"a: “the biggest difference right now between life in the u.s. and in venezuela is that venezuela’s democratic system is endangered under the governance of populist president  ks‘       , _ i . . . ter graduation?",1999-2000
"i heard more about the evils of the democratic party than about any platform issue, about any of the candidates for the nomination, or about any of the virtues that the venerable j.c. watts called us to portray in his magniﬁcent speech.",1999-2000
"when i was walking out of the warner center friday evening, a friend asked me if i was a democrat.",1999-2000
"why are we ﬁlling our prisons with harmless dopers when the real degenerates of our society —— murderers, rapists, democrats — are getting off with slaps on the wrist?",1999-2000
"sponsored by sponsoredgy h\'a§im‘i_-/floor‘  and the thnberpramers gmm ,  clahk contends that his wish for a humvee has ‘ the couegf democrat‘ i i 4300 p-\'“squash    ""on o1legé.",1999-2000
