this yankee liberal hopes to be hearin’ from y\'all in the next phi.,1989-1990
"get a job  challenge, a liberal—arts cavreer fair, will be held on thursday, oct. 26 at the student activities pavilion.",1989-1990
"of u.s. senators or representatives, app lcllllolls wl asseisse {ha or as mg on also seniors lahning lo allond the washington term program or they work in the white house, $25.llll°’ illel facully\'nda 50’ ‘e llellls‘ ilia \'cl_lal_le§lge liberal arts _ f provides washington and lee according to ingrid schroeder.",1989-1990
beth anne tysdale randolph-macon woman’s college escort: lee grable kappa alpha comment “i strongly support the liberal arts schools in virginia and speciﬁcally w&l.,1989-1990
"if there is any point in having such a committee at a liberal arts school, then it seems logical that such a committee would promote the same kind of atmosphere that is conducive to a liberal arts education an education which, under ideal circurnstances, promotes an open exchange of ideas for the benefit of none other than those who have the courage to exchange them.",1989-1990
"in the u.s. news ranking of “national liberal-arts colleges,” washington and lee placed 18th out of the top 25 schools.",1989-1990
"in its category of “national liberal arts colleges,” w&l finished as the overall best buy.",1989-1990
"i / / , / /  i‘ v i;  liberal houseuow e .. ’ /~:._.",1989-1990
"(i honestly think that our school can afford a new system and owes it to its students, especially since we were ranked as the number one best buy in a liberal arts education in the oct. 16 issue of u.s. news and world report.)",1989-1990
"“there was a very good range of companies represented, from the highly technical ones to the more general types of companies, and they were all interested in liberal arts students,” said henneman.",1989-1990
"a even many respected liberal legal scholars,  while agreeing with the decision, think that the legal reasoning is poor.",1989-1990
"according to charles bracelen flood, author of lee.‘ the last years, a group of swiss liberals decided to commission a painting to celebrate the union victory in the civil war.",1989-1990
4. consider the following quote: “i just don’t find people masturbating very artistic at all.” does this reflect the thinking of a student of a fine liberal-arts institution?,1989-1990
"a  . q: on page 65 of self-consciousness you said, ""nevertheless, however liberal my views, i had no dealings with blacks either as equals or as ‘ servants and was shy and nervous about them.",1989-1990
"also, i hope i’m a sufficiently good american , and a good liberal not to be... who knows what i really felt?",1989-1990
i was trying to describe my own feelings and my own reaction and using my reaction which wasn\'t a straight-down-the-line liberal reaction as an index for my own political character.,1989-1990
"perhaps my most memorable "" visit, the visit to washington and lee aside, was a trip to small, northeastern liberal arts school.",1989-1990
"""their program of study must be liberal arts oriented.""",1989-1990
"there are currently about 240 chapters at liberal arts and humanities oriented colleges and universities all over the country, said goehring.",1989-1990
"“almost all applicants mentioned course load as a  honor code, the role of washington and lee in training community leaders, appreciating the character of the student body and molding that character to the aims of liberal education.""",1989-1990
"“sports are critical to a liberal education,” said howison.",1989-1990
the former encourages liberal spending; the latter results in frustrated decorations chairmen.,1989-1990
daisy’s liberal sexual attitude is appropriately symbolized by a green light at the end of gatsby’s dock  letters  sororities.,1989-1990
this study is in no way a liberal crusade to wipe out sororities and fraternities on this  once  attention.,1989-1990
"kennan concluded, “the final answer might be an unpleasant one, but... we should not hesitate before police repression by the local government... it is better to have a strong regime in power than a liberal government if it is indulgent and relaxed and penetrated by the communists.”  the latin american people themselves could have democracy only if they chose their leaders from within the pool of candidates acceptable to the united states.",1989-1990
"they’re just gonna have to suck it up.”  in october, w&l was named a “best buy"" in liberal arts colleges by u.s. news and world report.",1989-1990
"l\'—‘r£5h a2/v r‘/51/,     d     looking back as a liberal  my voo doo by robert j. de maria  modern economic historians have recorded a crazy-quilt pattern of mergers, take—overs and other ﬁscal shenanigans that would have made the lateeighties bad-boy ivan boesky puff up with pride.",1989-1990
other problems with the new majors include protests by stubborn liberal females.,1989-1990
"at this time a young leader, whose distinguishing characteristic  ~was not a spot on his head, but his shortness in height, was all the rave among the liberals in europe.",1989-1990
"that liberal among liberals, ludwig van  the ring-tum phl, may 10, 1990  h0 w/lam $5/an/5 r£ally weeks   ‘""1              beethoven, even composed a symphony in his honor.",1989-1990
yet he did not remain in the liberals‘ favor for long.,1989-1990
"though he did codify laws and remove hundreds of tiny monarchies, he did very little to spread liberalism throughout europe.",1989-1990
"and all the while, gorby sits irﬁ moscow, merely waiting as his promises of liberalism stand idly by.",1989-1990
"in years past, the student body accumulated a small surplus each year, allowing the ec to provide liberal budgets without too much fear of an unexpected deﬁcit.",1989-1990
howison: one of the principles of a liberal arts education is that you’re exposed to new ideas.,1990-1991
"he was a frequent contributor to the spectator, and | recall several good-natured debates with him about the course of liberal jurisprudence in this country.",1990-1991
"he decried the tendency of ‘‘liberal’’ judges to be obsessively concerned with the rights of the accused, the careful adherence to procedure, and even the right to privacy.",1990-1991
i look forward to further elaboration of the spectator’s new liberalism.,1990-1991
"while most concede that the liberals did not invent judicial activism, no one  by rick peltz  john quinn, ’91, shreveport, la ‘tear night is an evening full of sound and fury, signifying nothing.’’     justice brennan resurrected, refined, and perfected its art.",1990-1991
"for nearly thirty years, it seemed that every liberal special interest group had their time at bat in the supreme court.",1990-1991
"the liberals and the nation ignored the congress, allowing its members to forget their constitutes in favor of lucrative pacs and the power-brokering game of throwing other people’s money at every social ill which somehow struck _ the conscience of a heartless political body.",1990-1991
the liberals thought they had  when ronald reagan slipped through their choke hold on the nation.,1990-1991
"though much of the constitution’s safeguards lay in ruin due to their efforts, the liberals have not -as yet -effectively dismantled its system of checks and balances.",1990-1991
"as the first generation of liberal judicial activists retired, many of whom appointed by republican presidents in good faith, ronald reagan had the opportunity to restore much of the judicial system, unquestioned.",1990-1991
"for the liberals, bork’s confirmation did not pose the question of judicial activism versus constructionism, they were concerned only with how activist the judge was and for what political purpose.",1990-1991
"the liberals wrote letters to congressional leaders, appealed to the nation through the media, and acted as though the supreme court were a political body.",1990-1991
"his digression on liberal judges is interesting, but it has nothing to do with the dorm counselor raid.",1990-1991
"of course, dean ruscio does not believe that the spectator is ‘liberal’?",1990-1991
liberal — the other 30 percent.,1990-1991
"u.s. news ranks w&l 15th     by cathy lopiccolo assignment editor     washington and lee is ranked 15th in a list of the top 25 liberal arts colleges, according to the oct. 15 issue of u.s. news and world report.",1990-1991
"william cocke in the w&l news office said the university has also been named the ""best buy"" among liberal-arts colleges for the second year in a row in the magazine’s 199] best colleges book, which will be released monday.",1990-1991
the top two categories are national universities and national liberal-arts colleges.,1990-1991
"amherst college placed first among national liberal-arts colleges with a perfect score of 100. w&l, the only liberal-arts college in virginia to appear on the list, received a score of 86.2. harvard university topped the list of national universities for the first time, while the university of virgina placed 18th with a score of 89.3.  according to w & l president john d, wilson, the u.s. news rankings are more valid now than they have been in the past.",1990-1991
"the top 25 national liberal arts colleges                 #13  24  . amherst college, ma  .",1990-1991
"a     phi gamma delta simone schonenberger, w&l ’91 escort: rick hughs comment: ‘‘studying a year abroad in germany has allowed me to appreciate the unique opportunities that w&l offers.”     sigma phi epsilon  claire devignier, randolph-macon’92  escort: pete castiglione comment: ‘‘i firmly believe in an academically demanding liberal arts education.",1990-1991
"after observing drug and alcohol surveys from other southeastern universities, dean of students david howison said alcohol and drug use at w&l  is similar to patterns at other comparable small, liberal arts schools.",1990-1991
i ae  is that not what a liberal arts education is all about?,1990-1991
"‘*for 27 years, i have tried to dispel the image that i was a liberal, that i believed in civil rights, that i believed in the nonviolence thing, but to no avail.",1990-1991
"but i reasoned that if i became associated with sen. jesse helms, everybody would immediately know that i was not a liberal.’’  meredith also said that in the year he has worked for helms, he has not encountered racism of any kind in the organization.",1990-1991
"we don’t need to reinvent the wheel.’’ the reply of a berkeley student when asked if they are protesting to relive the nostalgic, liberal-infested days of the late 1960’s: ‘‘we don’t want to be hippies or anything, we’re just concerned with what’s going on.",1990-1991
"we want to see all of the soldiers (and mar    coach thanks wé&l fans  ines) come home soon and safely.’’  are aware of how important their support is to the  i must admit the news of student insurgency at toops in saudi arabia, why don’t the students at tnese bastions of liberalism doesn’t surprise me, teputable institutions of higher education?",1990-1991
a 1990 national survey of college seniors indicated that three times more w&l students were satisfied with their student government and their voice in influencing college policies than students at comparable liberal arts colleges.,1990-1991
"this liberal policy,  which is based on the honor system, has gotten out of hand.",1990-1991
"‘there must be a sense of comprehensiveness in academic effort and a strong evidence of scholarship in the liberal arts and  sciences,’’ said goehring.",1990-1991
the publications board decided not to fund the publication on the basis that it would be a politically liberal forum and they cannot fund a politically ideological paper.,1990-1991
or maybe it was because ‘‘free-thinking’’ seems to denote ‘‘liberal’’ (or ‘‘pinko-commie bastard’’) rather than ‘‘intellectual.,1990-1991
apparently she is not ‘‘black’’ enough to satisfy her liberal white colleagues.,1990-1991
"she is the recipient of the bruno kreisky award for human rights, the liberal international woman of the year award for 1989, the averell harriman democracy award and the united nations development fund for women award in 1990.  bhutto has written two books, foreign policy in perspective (1987) and daughter of the east (1988).",1990-1991
those army wieners be damned.”’ the out artice cited w&l’s  “‘steady march toward outright liberalism’’ as a main criterion for its selection.,1990-1991
"w&l ranks last among the top 25 national liberal arts colleges in the percentage of alumni that contribute, and the school has made a ‘‘considerable effort’’ to raise the percentage, mcmahon said.",1990-1991
‘‘the media was very interested in whether he was going to announce his candidacy.’’  mcgovern told the crowd he will run if no other candidate emerges who will stand for the liberal achievements of the democratic parly.,1990-1991
tional liberal arts .,1990-1991
so the illiberal educators come up with other reasons to disparage it.,1990-1991
"but don’t you dare question the academy or,  any of the illiberal faculty members!",1990-1991
"washington and lee, as the spectator continually espouses, is a liberal arts college.",1990-1991
a liberal arts education is one which liberates the mind.,1990-1991
"she really convinced us that she had an understanding of a liberal arts college,’’ peppers said.",1990-1991
"this liberal policy, based on the honor system, has gotten out of hand.",1991-1992
quote of the week  harkin admits to being a liberal.,1991-1992
past ecs have been reluctant to fund organizations perceived as politi       u.s. news & world report top 25 liberal arts colleges  williams college (mass.),1991-1992
"24. occidental college (calif.) 25. hamilton college (n.y.)     ©92 nonroens  ranking drops, but some still shop for the best buy  u.s. news dropped washington and lee from 15th to 22nd place in its latest ranking of america’s best liberal arts colleges.",1991-1992
"according to the magazine, out this week, w&l is still the best buy ina liberal arts education.",1991-1992
their liberal experiments with dividing the freshman classes by race and interest have been ended.,1991-1992
‘as long as we\'re appearing in the top 25 — as lone of the elite liberal arts schools in the country — we’re in good shape.”’  the magazine named w&l the | 22nd-best national liberal arts college jin its fifth annual guide to ‘‘amerjica’s best colleges.’’ last year w&l was 15th.,1991-1992
w&l is the least expensive of the top 25 liberal arts schools.,1991-1992
"“the important thing is staying the ‘best buy’ among national liberal arts colleges,’’ howison said.",1991-1992
"the overall rankings compare 140 national liberal arts colleges on the basis of academic reputation, selectivity, faculty-resources, total financial resources and student satisfaction.",1991-1992
"every sunday, for example, i walk around the backyard with a large grocery bag and my trusty double-pronged scooping implement and pick up the dog droppings that have accumulated over the week — damn good thing i have a liberal arts degree.",1991-1992
"randall p. bezanson, dean of the law school  ec erred in not funding aclu  to the editor:  due to the eagerness which w&l publications display for labeling people as liberal or, even worse, politically correct, i begin this letter with a disclaimer: i am not a member of the aclu (american civil liberties union), and i strongly disagree with almost everything it does.",1991-1992
"we believe the administrators, like thomas litzenburg and dennis manning, are why washington and lee is one of the nation’s best liberal arts colleges.",1991-1992
"there are several names for this revolution...pluralism, multiculturalism, diversity,’’ said dinesh d\'souza, author of the controversial book, illiberal education: the politics of sex and race on campus.",1991-1992
davidson was ranked 21st and w&l 22nd among the nation’s top liberal arts colleges.,1991-1992
he has been dragged through the mud by the liberal establishment and by the media and i am ashamed as a fellow citizen of this nation that he has had to endure such a thing.,1991-1992
"the liberals try |  miller responds to phi article  to the editor:  after reading last week’s headline story, i was appalled and thoroughly disgusted in the way that i was treated in that article.",1991-1992
"if thomas loses the battle, this will prove that congress now has supreme power over the judicial branch of government, and that congress will only confirm those who pay homage to special groups, and to liberal congressmen and congresswomen.",1991-1992
"jobs and law  seniors seeking jobs in new york, philadelphia, and san fransisco-los angeles must submit resumes for the selective liberal arts college consortium by 4 p.m. on oct. 25 in the cdp office.",1991-1992
"richard hill, in his my view last week, stated that clarence thomas was a winner in the confirmation process even though he was attacked by ‘‘the liberal establishment and by the media’’ and that he had suffered not the american dream, but the american nightmare.",1991-1992
"to register, call 1-800-545-1970 by nov. 15.  jobs  seniors seeking jobs in new york, philadelphia, and san francisco-los angeles must submit resumes for the selective liberal arts college consortium by 4 pm.",1991-1992
"ment.’’  according to barry-rec, she and her husband settled in virginia because it has the most liberal laws for parents to home-school their children.",1991-1992
"heidi traulsen, calyx business manager and pub board member, said that regardless of the editors’ intentions for this year with the new charter, the traveller was already ‘‘seen as liberal by the campus’’ and thus should not be recognized by the pub board.",1991-1992
"‘‘even in the face of all this pc stuff and after the liberal decades, the students keep their love for their school alive.",1991-1992
"barnard college (n.y.)     top 25 liberal arts colleges (ranked by endowment)  per student  name endowment 6/30/89)  swarthmore college (pa.) $231,871 $304,911,000 grinnell college (lowa) $214,995 $294 ,328,000 pomona college (calif.) $192,646 $271,053,000 amherst college (mass.)",1991-1992
"$68,849 $74,035,000 davidson college (n.c.) $56,340 $79,496,000  washington and lee university $53,637  as shown in u.s. news and world report, october 19, 1989  total endowment  (market value  $101,169,000 $113,160,000 $123,309,000 $53,629,863 $43,969,000  $53,302 $45,334 $34,511 $20,290        one of the major goals of the soon-to-be-announced capital campaign is to improve w&l’s endowment in comparison to  other top liberal arts colleges.",1991-1992
w&l’s ranking dropped seven places from 15th to 22nd place in u.s. news and world report\'s september ranking of america’s best liberal arts colleges.,1991-1992
"“‘as long as we’re appearing in the top 25 — as one of the elite liberal arts schools in the country — we’re in good shape,’’ murphy said in october.",1991-1992
w&l currently stands in the lower third of the nation’s top 25 liberal arts colleges ranked by endowment per student.,1991-1992
"‘‘shall we perpetuate the old prejudice which has existed for ages, and has only succumbed to some extent to the liberalism of the twentieth century?",1991-1992
"mr. mackenzie evidently revels in his self    opinion  page 3                 letters  proclaimed glory as the liberal ‘‘campus wit.’’ (unfortunately, he has a lot of competition.)",1991-1992
"let us not forget, mr. mackenzie, that limousine liberals like you are constantly shrieking about economic inequality.",1991-1992
i enjoyed having democratic and liberal views in print until.,1991-1992
"i, sir, also consider myself a democrat, and a liberal.",1991-1992
"s  ’ 4, i consider myself neither a democrat nor a liberal.",1991-1992
"g oal b oun d  after radford, the team can really  photo by leigh allen, the ring-tum phi     start to focus and begin to prepare for the liberal arts invitational.’’ in w&l’s pre-season opener.",1991-1992
"they get their chance today at depauw university in indiana, where the generals begin swimming in the three-day liberal arts invitational.",1991-1992
"freshman catcher todd stanton had three hits and drove in two run, and junior jon  w&l women’s swimmers take 5th at depauw  by erin mckinney phi staff reporter        the washington and lee  women’s swimming team ended their |}  season last weekend with a respectable fifth-place finish at the liberal arts invitational at depauw university.",1991-1992
"“it was tough to swim (at liberal arts) coming off of odacs,”’ said jacobs.",1991-1992
"the generals gained some well-deserved respect by placing third at the liberal arts invitational, behind wabash and depauw.",1991-1992
"‘‘but i think everybody was ready to go to their keg parties.’’  all the speakers at the convention proposed what they called a ‘new vision’’ for the democratic party: a breaking away from the traditional, liberal moorings that have characterized the party since the time of franklin d. roosevelt.",1991-1992
"‘*we tried to propose things that are different from the traditional, liberal, interest group platforms that the democrats have put out before.’’  during most of the convention, delegates were supposed to act like their real-life counterparts, even if      stonewall square     photo by teresa williams, the ring-tum phi  wé&l dems gop platform  w&l students, we welcome you to our your next haircut.",1991-1992
"midwest regional coordinator cottie miles « presented a more liberal position than , that of the platform: that medical care, like legal representation, should » be given freely to those who can’t | afford it.",1991-1992
"take your most liberal estimate on what you think you\'ll need and add at least $50, depending on your spending habits.",1991-1992
"in an effort to score points with its highbrow liberal counterparts, the law school has abandoned its mission of solid teaching of substantive fundamentals,  instances such as this go a long way towards explaining our school’s fall from grace in the eyes of our profession, our alumni and our community.",1991-1992
"liberalism developed when liberty was threatened by the forces of  has shifted, to the disadvantage of democrats.",1992-1993
"“they ‘sgid we had a liberal agenda, but they  uldn’t back it up.”  walsh also said the magazine would not have relied on the pub board for printing costs.",1992-1993
"but to williarnson’s charge that she is a “far-out left-wing liberal” from “the chicago machine,” she replies, smiling, that the charge is “an oxymoron” because the machine is inhospitable to far-out left-wing liberals.",1992-1993
"despite the rainy + weather and dreary skies, the races in charlottesville still  ington and lee 22nd among national liberal arts colleges.",1992-1993
"w&l’s operating budget is lower than other liberal arts schools because of low tuition and the fact that w&l does not use tuition revenue to fund scholarships, litzenburg said.",1992-1993
"‘ a"" w&l students are still the smartest shoppers aroimd. .   -w&l “ranked number one in “best buys"" among ‘yiliberal arts schools in u.s. news and world report\'s .",1992-1993
"allpossessed of limited intellects but powerful prejudices, the federalists know that its easy to relax in lexingare young men and women so upset by the liberalizing influences of worldlinesg ton, and the possibility of something and education that as their horizons broaden to about the diameter of apinhead like this happening here is remote.",1992-1993
"washington philadelphia new y0tk san francisco chicago the selective liberal arts consortium (slac) .‘ v job fairs are for you,   with impressive numbers of good companies: , i‘ "" §l0$9t_th0"" ~ ~ you think!",1992-1993
"§ctmeider said the aclu wants _ 0 get students more involved with s°h""°\'de"" e bill of rights and that a liberal arts university has an 0 bligation to educate its students about national and interna\'onal issues.",1992-1993
"recent administration testimony supporting nafta resulted in this cockamamie headline:  “trade pact could cost up to 150,000 jobs”  the administration also says there would be 325,000 new jobs created in the ﬁrst five years, a net gain of 175,000.  but stay with the idea of “lost jobs.” lftlie mentality common among nafta’s liberal critics had prevailed when the automobile industry was in its  infancy, government might have strangled the infant  _ in its cradle—in the name of “compassion,"" of course.",1992-1993
"washington philadelphia new york san francisco  the office of career planning and placement at the university of virginia invites you to attend the  k financial aid for spring term abroad programs     chicago then you need to meet this important deadline: resumes due in the cdp oﬂ‘ice before 4:00 p.m. on friday oct 23. to review company descriptions and learn about submitting resumes, come to the career development and placement office  the selective liberal arts consortium (slac)       ninth annual minority career day:  tuesday, november 3, i992 omni hotel ~ downtown charlottesville  1992-93 financial aid form must be on file in the financial aid office to receive financial aid for spring term abroad.",1992-1993
