"the democratic nominee for sena tor is robert abrams, the state’s attor= = ney general, who recently madenewsi  by skipping manhattan’s columbus day parade and calling his opponent, two-term incumbent alfonsed’arnato, a “fascist.” abrams is a liberal in good standing (wants to cut defense spending 50 percent; favors gay rights as a litmus test for judicial norriinees) but did not duck the parade for the correct liberal reason (that columbus was a fascist who inflicted eurocentri sin and syphilis on the indigenous peoples of the north american paradise).",1992-1993
"for more inforrriation call 463-8984.  cd&p  the deadline for submitting resumes for the selective liberal arts consortium job fairs in new york city, chicago, washington, d.c., philadelphia and san francisco is friday, oct. 23 by4p.m.",1992-1993
"that was a contrast to schneider’s liberal image on campus, arising from his association with the aclu.",1992-1993
his party is full of believers in litigious liberalism.,1992-1993
liberals confuse an adjective (“fair”) with an argument.,1992-1993
actionary liberalism —— defense of factions strongly organized and skillfully represented in washington.,1992-1993
“the women’s forum was not a group of braburning liberals.,1992-1993
their activism is both a cause and consequence of “interest-group liberalism”—belief in brokering maximum satisfactions for the maximum number of factions.,1992-1993
"this seems to be due primarily to misconceptions about the nature of amnesty international, which is not a liberal, radical, or politically partisan group.",1992-1993
"after 1988, the democratic chorus seemed to have shrunk to a duet of blacks and white liberals.",1992-1993
our liberal policy is being abused entirely too often.,1992-1993
"patterson says his research on wilson and the interview both gave an impression of the president as a true man of letters, a staunch and vocal ‘advocate of liberal arts education.",1992-1993
"greg sandage  to the editor:  i realize that the inaugural ball has created some hysteria among the nation’s liberal populace, but if the recent actions of this faction’s branch at washington & lee is any indication of future behavior, then the nation is in deep trouble.",1992-1993
"the increasingly liberal administration, with notable exceptions, has refused to recognize the defamation of one of the university’s most historic and powerful organizations.",1992-1993
they have ignored the words of the college republicans who favor idea exchanges and actual brain activity instead of the wallet activity of the more liberal clubs.,1992-1993
it is time for the liberals to come down to earth.,1992-1993
"“my senior year, w&l was at its best as a liberal arts institution,” he said.",1992-1993
"in spite of the fact that they will probably graduate with a degree from one of the finest liberal arts schools in the country and land a job earning large sums of money, they will be altogether absent of any perspective other than their own.",1992-1993
"fukuyam a, who wrote the end of history and the last man  \\i‘iith,l._he‘ fallaoflcommunist d authoritarian regimes, history has fulﬁlled its p rpose: the recognition of liberal democracy as  the most effective form of government.",1992-1993
"this is an cxampleof what can be called “mandate liberalism”: if the government is strapped for funds, make the private sector spend.",1992-1993
"due to the recent trend of liberal movements on college campuses, many newspapers and maga kathekon  kathekon, w&l’s student     needed  dance choreographer for spring term musical production at the lenfest center.",1992-1993
"i made the argusome 50,-t offeat-fult-c*5 ‘ms; 3  ._ of their own doctrine and feelings, allpleasures and disgusts line for applications is march 5. p rnentthat theliberal contingent like-5 t0 sporise from me.",1992-1993
"\'    sociate position in 1993-94 should r1ip0ter1t liberal m0verher1t"" of the eel‘ intellect, enoughpride,orenough faith, punishable by law.",1992-1993
"lenfest said his liberal arts and law education taught him “how to think"" and allowed him to excel in different areas.",1992-1993
"the republicans have been deliberately allowing appointments to pass without undue harassment because they are anxious to see the government start acting its “magic.” zoe baird had received this treatment with a complementary endorsement by senator orrin g. hatch of utah but suffered the first blows of rejection at the hands of ralph nader of the democratic left wing when he labeled the lawyer an “anti-consumer tool of corporate interest.” following the nader attack, the public found baird to be a rich, liberal socialite living in a fancy new haven, conn.. with a chauffeur-driven car and the memberofanciglrlxniiootlzissocintimr lfying l()l1l0(‘l\\ ll(\\llsllll[ for punt kills  ll .\\‘(\'t‘lll.\\\' that mvlvml\\ lll the ruin.",1992-1993
"i would not pay this much for a liberal school,” sophomore jackie vanvliet said.",1992-1993
"it would stop persecuting him if he would accept the punishment prefeied by totalitarian regimes and american campus liberals; re-education, in the form of “sensitivity” training.",1992-1993
i know that some on the ec fear than open funding policy would precipitate an avalanche of liberal organizations ranting and raving about the university\'s shortcomings.,1992-1993
".-.-, . .  vative citadel from a liberal siege.",1992-1993
"if liberal suppon should proliferate in the wake of a funding policy, an effect 1 would embrace ifnot expect, we ought to receive that outcome as a popular response reflecting student body sentiment.",1992-1993
"if an open policy sparks liberal activity, so be it.",1992-1993
any honest administrator will tell you that the only major reason that w&l is not seen in that precious top ten list of liberal arts colleges is our total  was only at that  moment that it truly occurred to me that you were leaving.,1992-1993
"leyburn was head of the department of sociology and anthropolgy until 1967, retiring as dean and professor emeritus in 1972.  almost as soon as he began his career at w&l, leybum proposed strengthening the university’s academic standards and making the curriculum closer to the liberal arts ideal.",1992-1993
"personally, though mr. mcdermott and other like—minded illiberal won’t believe it, i bear no ill will towards professor hedquist.",1992-1993
"and for that they were greeted with nothing less than the hypocritical, unqualified r sentment of a small, but vocal, minority within the w&l community whose best definition of diversity is to convert washington and lee into one of any number of small liberal-arts colleges that currently clutter the landscape of higher education.",1992-1993
"as i recall, professor peck offered a vigorous defense of professor hedquist’s right to free speech, and an extended analysis and critique of the illiberal climate of opinion, sown and cultivated by the spectator, that resulted in the harassment of professor hedquist for well over a year.",1992-1993
you came to one of the best liberal arts universities in the country because you wanted to be challenged.,1993-1994
"“his legacy lives on in our commitmentto teaching and to the liberal arts.”  “his concepts of personal honor, integrity, and selfdiscipline set a wonderful example for generations of washington and lee students,” wilson added.",1993-1994
among leybum’s objectives when he came to washington and lee were the strengthening of the university ’s academic standards and bringing the curriculum closer to  the liberal arts ideal.,1993-1994
mention the word on campus and many students instantly think you are pushing a “liberal agenda” or striving towards political correctness.,1993-1994
w&l ranked 20th among the nation’s best national liberal arts colleges in this year’s edition of u.s. news and world report’s college rankings.,1993-1994
amnesty lntemational s e the second option would seem chnelder . . and the w&l aclu ’ to be the wiser one for a liberal arts co-sponsored an ex— ’94 institutionlike w&l.,1993-1994
thus refusing to fund all “ideologically partisan” organizations would result in a vitually one-sided exchange of ideas  on campus— certainly not beﬁtting of a liberal arts:  while keeping on the payroll other ideological organizations has the stench of blatant “political correctness.“ hopefully the ec will sensibly rectify this situation in a tirrﬁly fassion before amnesty and the aclu are forced  the proposal looks very nice‘ onitjs sdffacé.,1993-1994
"university stands at crossroads  last week u.s. news and world report released its annual rankings of colleges which upgraded w&l to 20th among small liberal arts co1leges.the rise comes from the fact that w&l has more students who graduated in the top 10% of their class, a lower acceptance rate, and a higher sat average.",1993-1994
w&l provides a solid liberal  the academic environment would not improve due to a 50/50 ratio.,1993-1994
a learning environment arts education within a community that prides its pm‘ office box 899 indistinguishable from any other liberal arts college.,1993-1994
"it is part of an 11-member selective liberal arts consortium (slac) that counts bryn mawr, haverford, vassar and pomona among its members.",1993-1994
"for example, carleton college is often considered the pinnacle of liberal arts colleges.",1993-1994
i found it hard to believe this community so infiltrated with pc could actually foster liberal education.,1993-1994
free speech in a politically correct school is no longer considered a requirement for liberal education.,1993-1994
"preserved its unique position among liberal arts colleges for generations, it would be a tragedy to see the new president make it just another ordinary pc saturated college.",1993-1994
students who want a liberal arts education prefer to avoid institutions which pursue the politically correct and neglect legitimate education.,1993-1994
they are one of the_ major reasons w&l ranks high] on the lists of top liberal arts colleges like that published by u.s. news and world reports.,1993-1994
"if it were not for the women on this campus, w&l would be nothing more than another mediocre liberal arts college, instead of 20th in the nation.",1993-1994
the university has taken best—buy honors in u.s. news & world report ’s rankings of liberal arts colleges for three years running.,1993-1994
"_ _ ‘  w&l’s net assets —~— $181 million in 1991 — are less than half those of amherst and williams in massachusetts and swarthmore in pennsylvania, the three school u.s. news picked as the top liberal arts colleges in the country.",1993-1994
"skﬁitr  \'1  3 c your student 3 -*  redeemable for breakfast,      l.  ‘i                                                                                                                                   0 the fling-tum phi, october 29, 1993  liberal—arts institutions in that area, institutions which have been very successful overthe y rs the compounding effects of gifts is incredible.”  mcmillan said broomall is right.",1993-1994
"elrod said the undergraduate programs at the eight colleges in the study, all of which outranked w&l in the last u.s. news and world report survey of liberal arts colleges, do offer a good basis of comparison for w&l.",1993-1994
chretien takes over as prime minister of canada  liberal party leader jean chretien took over as prime minister of canada thursday after the labor party was catapulted into power in reaction to voter dissatisfaction with the economy.,1993-1994
"the liberals pulverized the opposition in last week’s general election, winning 177 of the 295 seats in the house of commons.",1993-1994
mcwilliams said the ideas presented in the book represent “the essence of co ervatism and the essence of liberalism and the essence of what jesus taught.,1993-1994
"of career development and placement, the selective liberal arts consortium sponsors interviewing days with various companies in new york, atlanta, washington, d.c., chicago, los angeles and philadel phia.",1993-1994
"without the honor system, w&l is little more than an obscure small liberal arts college in a small town.",1993-1994
"quotes of the week:  “and the award for the fastest dong goes to ka and phi delt.” ——a theta at the “gong” show  “what’s on your mind?” ——an audience member ’s response  “the colonnade is a paradise for brick fettishists.”  —english professor george ray  opinion  the ring-tum phl, november 12, 1999 v  :73 \'  black studies would debase w&l  looking at most college catalogues you would not notice that they fail to provide their students with a liberal arts education.they are full of statistics on how diverse the student body is and statements on the institution’s commitment to multi—culturalism.",1993-1994
"these facts, along with a lot of pretty pictures, give the impression that the school’s “diversity,” both in its student body and curriculum, will make its students well rounded; liberally educated.",1993-1994
"they do not seek a “diversity” of ideas, rather they only want more liberalism.",1993-1994
we might as well call it a liberal activist major.,1993-1994
"“a college experience,” mr. branam say “should be expanding your horizons.” unfortunately the only expanding of horizons that would occur with a black studies major is the expanding of the liberal position.",1993-1994
washington and lee has for the most part avoided engaging in this debasing of liberal education.,1993-1994
"this is what a liberal arts education is suppose to entail, not specializing in one narrow topic.",1993-1994
"recently a proposition has been put forth that would, if successful, begin decaying w&l’s tradition of producing liberally educated graduates.",1993-1994
"anyone sincerely concerned with obtaining a liberal arts education certainly is aware of the values of alternative points of view, but a black studies major would not bring new viewpoints to w&l.",1993-1994
a black studies major would only further promote the same old liberal viewpoint that is already adequately represented on campus.,1993-1994
the only students who would generally ﬁnd such a major of interests are liberals.,1993-1994
or is it that he only wants a diversity of liberalism?,1993-1994
"can any one claim to be liberally educated who is unfamiliar with the works of shakespeare, locke or newton?",1993-1994
the latter are important works that any liberally education person should understand.,1993-1994
"trying to replace them with works of lesser value, simply to have minority writers, corrodes the  ideal of liberal education.",1993-1994
\' those advocating diversity as a means to open student minds to new ideas should realize that a liberal art education achieves this goal.,1993-1994
"this is what a liberal arts education is suppose to entail, not specializing in one narrow topic.",1993-1994
the point is that a liberal arts education examines the contributions of all groups to the intellectual achievements of mankind.,1993-1994
hopefully they understand the purpose of a liberal education and will accordingly disregard the proposals.,1993-1994
our liberal democratic society requires a presumption of innocence unless guilt is proven in a court of law.,1993-1994
u.s. news and world report ranked w&l 20th in the national liberal art  college category.,1993-1994
if you would like more information please call john white at 464-8560 or 377-2225. volunteer training starts on jan. 15.  columnists  the phiislookingforabiweekly liberal political columnist.,1993-1994
". . . . . . . . . . . . . . . . . . . . . . . . . . . . . . . . . . .. sally obennueller would pa‘ _ . make 3 0n_g vane"" pa em_s\'gm lcancetotwo olen couma 1 lty‘ , _  glnivenising assistant , _ _ , , , _ _ _ , , _ , , _ , _ _ _ , , , , _ , _ _ _ , , _ _ , , _ _ _ , , , , brian widene, tiently wait for a briton to hit the ball story short, l3roughton pouredout his dead american so, if the afn—  icncniniion manager , , , , , , , , , _ _ , , , , _ , , , _ , , , _ , _ , , , , , , , _ _ _ . . ,,i3nan carpenter over the fence, so he could dutifully life, quite liberally, combating the soldiers.",1993-1994
"an  officer that is anti-gay is more likely to actively investigate and effect the prosecution of conduct violations, while a more liberal officer may chose to overlook some minor violations.",1993-1994
"if you ask w&l students what brought them to this small liberal arts school in southern virginia, many ofthem will tell youthe honor system played a role in their decision.",1993-1994
the language lab is under the direction of p. richard kuettner who has already made the language laba leader amongthe facilities at other liberal arts colleges.,1993-1994
"to believe that environmentalists are  sports editor . . . . . . . . . . . . . . . . . . . . . . . . . . . . . . . . . . . . . . . . . . . . . . . . .sarah gilbert ""lg nuts and bet"" dlsposal may tllere \'5 3 difficulty ln lecxcllnga e5pe\' pan of some liberal fringe that wlll  assistant sports editor .",1993-1994
"miles commented that w&l is “doing extremely well against [other liberal arts schools], applications are way up in the law school as well —— both are  i3-8084-8585-06868787-8888-8989-9090-9191-9292-9393-9494-95 %increue 6.67 10.18 7.53 6.32 8.32 6.18 10.36 7.20 7.23 6.08 6.08 4.31 ’ dp  running against the national trend.",1993-1994
"a i bigdeali daddy’: alraudypaidtbar mucbinpnlzing tioéezsl wowwbmigtbls o photographers’ o \'0  limbaugh misjudges liberal values  deﬁnition, i qualify as an “environmental wacko.” i do believe that the earth is fragile and that man is its greatest enemy.",1993-1994
"before anyone beginsto imagine that i agree with him, rush is completely wrong in characterizing the ideals and motivations of most liberals.",1993-1994
there are some people who claim to be liberals and take on causes to promote themselves.,1993-1994
"however, for myself and most liberals i know the goal isto help people help themselves and to preserve things important to man, such as the earth.",1993-1994
"rush suggests that many liberals run foundations purely so they can siphon off large sums of money for themselves, while still feeling good about helping someone.",1993-1994
"however, most liberals do not run foundations.",1993-1994
rush also suggests that liberals prefer to throw money at a problem instead of actually solving it.,1993-1994
"first of all, this is hardly a liberal fault.",1993-1994
"on the other hand, the liberal community has been engaged in teaching people about means of preventing the spread of the disease.",1993-1994
it is true that it would be impossible to give a detailed history of every ethnic group in  most liberals do not run foundations.,1993-1994
"the argument undergirding mr. kucera’s entire case against govemmental restrictions on the recreational use of marijuana, seemingly, is summed up in this one phrase of his: “in a country which puts a high premium on freedom, those behaviors which do not harm society should not be legislated against.” in essence, kucera restates for us the age-old bit of liberal wisdom that non-invasive morality (involving moral choices that directly involveonly the chooser, like smoking marijuana by oneself) are the individual’s business, and not the state’s.",1993-1994
paralleling his rise has been the (political) liberalizing of the college to an amazing extend.,1993-1994
"there is much more at stake here  \' liberal arts is the  than simply not having a place to drink beer; it is a question of the right of assembly, a right which could, and has, been equally established for women via sororities.",1993-1994
"what the students of this university must make clear to the presidential search committee is that we do not want just another northeastern liberal arts college, whose notion of  requirement of a women’s history course or one in underwater bas when i heard this i thought it was good news,  as a washington and lee student, and (hopefully) future alumnus l implore the search committee to seek out a president who knows w&l.",1993-1994
"this individual need not, necessarily, be a w&l alumnus; he must be one who believes in what a liberal arts education means.",1993-1994
another northeastern liberal (arts) col lege.,1993-1994
"brian richardson publications board advisor     i terviews and photos y joe framptom o  tt jackson, ’94, hanover, pa. — eam of broccoli because it will  with you the rest of the day.” inside.” 0     talkback  a column, ‘-‘limbaugh misjudges liberal‘  film  the film society presents like water for chocolate (mexico, 1993), directed by alfonso arau.",1993-1994
"unfortunately, nova clarke misunderstands this capitalist idea in her recent  values.‘-’>’c~m~ ~‘~   miss clarke claims that “rush is completely wrong in characterizing the ideals and motivations of most liberals,” but it is her that is wrong in characterizing rush limbaugh himself.",1993-1994
"granted, rush limbaugh does clothe his ideas in a language and style that is appealingto most ofhis viewers, but he does not characterize liberals in the way miss clarke claims he does.",1993-1994
"rush limbaugh would indeed characterize miss clarke as a liberal, but not only politically.",1993-1994
rush would lump miss clarke with other liberals in the way she handled her column.,1993-1994
"then, she ended her column with a list of all the wonderful things liberalism has to offer.",1993-1994
"rush agrees that many liberals do have good intentions, but he also believes that these good intentions and the emotions that go along with them are the things that need to stay out of politics.",1993-1994
"liberals claim that “we must care,” when what we really need to do is think.",1993-1994
"likewise, many liberals today refuse to allow white parents to adopt black babies, claiming that black babies’ “ethnic identities and culture” will be threatened should this be allowed, but the long-term effects of this emotional issue are again ignored and not fully thought out.",1993-1994
"rush would agree with many of the liberal ends of policy; no one is for poverty, toxic waste, or aids babies.",1993-1994
"but liberals like miss clarke think that only their emotional, irrational policies are the cure and that they are the only ones that “care.”  this is the way rush limbaugh characterizes liberals, not by petty concerns over money and selﬁshness as nova clarke suggests.",1993-1994
“symbolism over substance” and “emotion over thought” are the real concerns that rush has about liberals.,1993-1994
"lorig said seniors can participate in programs such as the selective liberal arts consortium, or slac.",1993-1994
"the effort inspired national attention when radio commentator howard stern called the w&l campus, “the damndest.bunch of liberals i’ve ever seen.”               page 4 of 10  ring  by amy fisher phi psyeo slut      3|-lpﬂllil  financial problems plague you this week.",1993-1994
i hope all liberals of good faith will join me in advancing these important goals:  1) the hierarchy of american society should be immediately stripped of all wealth and power.,1993-1994
‘  the right-winged five to 10 percent of the students who want to see me as the dogmatic liberal female.,1993-1994
"this may be so, but the alternative        the concept is foreign to.many of my classmates from high school attending liberal colleges in northern cities,/a barn in the middle of the country,   that when days such as those of this past week role of reducing the signifisurrounded by fields, ‘ . . around, students often don’t, thus they have invented cance of the fraternities \' in which bands come  i spring term.",1993-1994
"we aim to discuss topics relevant to a liberal arts education including those that are social, political, philosophical, religious, economic, scientiﬁc, artistic, historic, or literary in nature.",1993-1994
"at such a small liberal arts university as this, it  ’ would seem practical to have a universal registration  procedure, for inter-departmental fairness if nothing else.",1993-1994
he putsforthsuccinctlythe problemsandvirtuesof both black liberalism and conserv_atism.,1993-1994
"we aim to discuss topics relevant to a liberal arts education including those that are social, political, philosophical, religious, economic, scientiﬁc, artistic, historic, or literary in nature.",1993-1994
"this latest brain cloud to come out of the dean of students office is yet another example of the administration wanting to be just like every other liberal arts school in the top 25 of the u. s. news and world report, so we can rise in the rankings.",1993-1994
we are not every other liberal arts college and we should not try  to be.,1993-1994
"oh, l forgot to mention the most important part, invite all your liberal friends (provided you still have any liberal friends) and make them watch this tirade of pleasure.",1993-1994
"other protests have reportedly been filed including absence of a written bocce constitution, failure to mow the grass on the lee-jackson field, darkness, lopsided bocce balls, and confusion about the place of bocce at a distinguished liberal arts  college.",1993-1994
"if you have any information re \' garding this incident or any other  similar to it, please notify the lexington police at 463-2112.  graham-lee-wash. society debates u.s. news ranking  by michael hewleti‘ phi staff writer  should washington and lee strive to be one of the top 25 liberal arts colleges in the united states?",1993-1994
