"kull said the people who calculate the rankings of the top 25 liberal arts colleges do not care about"" the""unique-‘traditions of washington and lee and neither do the students.",1993-1994
"infonnal interview and never had to  kathleen eastland, who will teach french at darlington school in rome, ga., used the career ofﬁce to schedule her interview through the selective liberal arts consortium.",1993-1994
this is the place  you came to one of the best liberal arts universities in the country because you wanted to be challenged.,1994-1995
you can bet that a four-year soccer player is in good shape and has aquired some of that great well-roundedness that liberal arts universities are so famous for.,1994-1995
w1!‘ now be three showings of each ﬁlm: mouseisreleasedfromprisonandlook“a few liberal libraries and the make you think hard about the trifnday at3;()0 ann saturday at7;0(land ing for the person who turned him in to school system had wanted to ban the umphs and tragedies of human life.,1994-1995
addverted to the preing to aristide’s vious pattern of  questionable credentials as a liberalminded democrat is his reputation as a quasi-marxist.,1994-1995
"w&l is now the 15th best liberal arts school in the nation, according to u.s. news.",1994-1995
"w&l, along with 163 other schools, belongs to the category of national liberal arts colleges.",1994-1995
"a liberal arts institution as fine as washington and lee (it is, after all, number 15 in the nation) should be able to generate more interest in creative and visual art.",1994-1995
liberalthan the i s m . o t h e r what i w a y   m e a n around.,1994-1995
"and second, this focus on people in suggest, then, is that liberalism is much more than just a maniacal collection of conupt and despicable politicians; it is, rather, in its most dangerous form, a mindset — a mindset that enjoys considerable currency with the american people.",1994-1995
"perhaps spotting me as a liberal, she explained, “lt’s not as easy to get a gun in virginia as you might think.” it was all terribly enl i g h t e n i n g and, at least for a moment, took my mind off of the fact that a shotgun hanging from the ceiling on display was pointed at my head.",1994-1995
"meet the banker  all students are invited to “meet the banker.” matt steilberg, ’87, an english and german major who works for first union bank will be on campus oct. 19 between 1:00 and 2:00 in the career development ofﬁce library, to discuss how a liberal arts degree translates to the business world.",1994-1995
"this attitude is precisely what cosmopolitan, liberalminded modemists believe leads to war, division, and hatred.",1994-1995
“thish ish how we shcare those liberals!” he yelled.,1994-1995
"“nashty, nashty liberals!” he mugged and vamped and the crowd went wild.“that’s right, he’s got it, they oughta be scared,” said a man in the crowd.",1994-1995
"“the college republicans are happy  with the results becuase the mood of  the campus has been more liberal,” he  for several hours.”  she said the election does not accurately predict how the virginians will vote, citing that only a tenth of the students voted in the election.",1994-1995
the inclusion of this literature violates the spirit of a liberal arts college.,1994-1995
"in 1994, however, voters realized that re-electing these liberal democrats meant more of the same.",1994-1995
"and of those liberal democrats who managed to hold onto their seats in congress, majority (soon to be minority) leader dick gephardt, and perhaps the biggest symbol of the liberal establishment, senator ted kennedy, all squeaked by on tuesday.",1994-1995
"kennedy won narrowly in the most liberal in the nation, the people’s republic of massachusetts.",1994-1995
"even if the throw the bums out attitude was prevalent in the election, it was a throw the liberal bums out.",1994-1995
"not one republican incumbent in the house or senate lost his/her re-election bid, in sharp contrast to the  general could offer their ideas in sharp contrast to the ideas of the liberal establishment.",1994-1995
"1996,“the lesser ers will of two decide if evils, but b i i 1  because americans voted for republicans and theirideasoverthe liberal establishment.",1994-1995
"“a lot of people on contact felt she was a liberal crackpot.”  the committee decided against bringing guinier to campus, but the american civil liberties union, the minority student association, and other organizations are bringing her to campus in february.",1994-1995
smith spoke thursday in lee chapel on “the origins of leadership: a liberal arts perspective” during the founders’ day/omicron delta kappa convocation.,1994-1995
he talked about how a liberal arts education can provide the foundation for leadership.,1994-1995
"“it’s been my opinion that a liberal arts education is the source of social leadership,” he said.",1994-1995
smith believes a liberal arts education shapes this perspective and provides moral literacy.,1994-1995
"for me visceral doe_sn’t ‘imply the big-hearted liberals, but the democrats who are emotionally tied into the country as a whole.",1994-1995
". . . . . . . . . . . . . . . . . . . . . . . . . . . . . . . . . . . . . . . . . . . . .stephen williard ingly devoted to the ljbemj democratic regime, and future generations away from a liberal society.",1994-1995
"-—rita yeung , lam tin , hong kong _  international overvievv  by melba merritt crossroads staff writer  aside from attracting top students from all across america due impart to its prestige of being ranked one of the best liberal arts schools in the country, washington & lee has also attracted a number of students from foreign countries.",1994-1995
"“mylie evers (the new president of naacp) told everyone she was going to turn the organization around, with a new agenda, and then said they were going to be the cat’s paw of the democratic liberal agenda in washington,” keyes said.",1994-1995
"language and liberal arts programs  el belize cl niamey, niger d grenoble, france u oxford, england el haifa, israel d padova.",1994-1995
"on halloween, 1994, the supreme court granted certiorari, setting the stage for, as pat buchanan might describe it if he were a liberal hothead instead of a reactionary one, one of the greatest acts of legal cross-dressing in history.",1994-1995
"the black liberal establishment, as he sees it, has distanced itself from the black community and has assisted in the destructive policies of the liberals.",1994-1995
"people seem to equate that with a  o t e  l’ve been called a raving liberal but taken positions on feminist, 07‘ at least the other feministissue,whenitisreallyamatter _ neveraemotional female (at least that issues that oppose no h t eo le example i ofcouitesy;iholddoorsopenforpeople “does anyone have a g-str1ng?” ican remember).",1994-1995
we are unique among liberal arts colleges in our tradition and student freedom in learning in various extra-curricular settings.,1994-1995
"i came from portland, oregon, hotbed of liberalism and the “alternative culture,” and at ﬁrst, i did not understand the south, the invincibility of time-honored traditions or the ultra-conservatism of this school.",1994-1995
"it’s a heinous plot, and since i’m from california, it’s my duty...  y’know, the basic problem with pat buchanan is, he’s a liberal panderer.",1994-1995
"unique, such as student freedom to make decisions, and are more concerned with w&l making the list for top american liberal arts schools in u.s. news and world report, webb said.",1994-1995
"by this line of reasoning, amherst and williams are the nearest thing to perfection that any liberal arts college can hope to achieve, and we ought to concentrate our efforts on following their esteemed examples.",1994-1995
"the truth is, of course, that fraternities are offensive to some left-leaning bureaucrats for reasons other than simply their ten dency to promote the irresponsible use _  of alcohol; many members of the w&l community also want to abolish fraternities in order to help exorcise any lingering ghosts of gender distinctions frorri our society, which is, it goes without saying, far aﬁeld from the primary purpose of a liberal arts college.",1994-1995
"1, for one, came here,’ and forswore more typical liberal arts colleges, for a very good reason: w&l is unique among american universities for its high academic, cultural and ethical standards.",1994-1995
"“the challenge is... not to tell the world what we’re opposed to,” said kemp, “the question isn\'t what we’re against, but what we’re for.”  kemp expressed the need for everyone to work with together and participate in light of the recent oklahoma city federal building bombing.“the events in oklahoma remind us of how much we have at stake...” kemp said, “we have the responsibility of protecting the greatest liberal democracy on the face of the earth, and this great university is at the epicenter of preserving that system.”  after 13 years playing professional football, kemp was elected to congress in 1970 as a representative from buffalo, new york.",1994-1995
"page 8  opinion  faculty breaches of autonomy have gone too far  ii>from autonomy, page 7  faculty and administrative intervention stem from an attempt to compete with other similar liberal arts schools, notably davidson, which is the only other prominent southern school in the u.s. news and world report rankings.",1994-1995
faculty and administration members take note: i am no left-wing liberal crackpot who feels that this school owes him anything more than he has earned.,1994-1995
van dyke said homogeneity conflicts with the goals of a liberal arts education.,1994-1995
"“the goal of a liberal arts education is to open yourself to different people.”  once the main debaters had made  by cindy young phi news editor  home to such campus events as the evans dining hall pig roast and the mr. w&l pageant, the baker quad last wednesday, may 17, set the stage for the first annual kappa alpha theta  date auction.",1994-1995
"(i realize this sounds rather silly and perhaps a bit...tortured, for lack of a better word—like an overly sensitive liberal or something—but i am trying to recreate my own thought processes here.)",1994-1995
tional liberal arts college in the nation.,1995-1996
",3, college search, however, the university does focus “we should be proud to beincluded on the areas to which surveyors look among the best national liberal arts when s00rlhgthus, the uhlv¢fsity colleges in the country,” said dean of wins these accolades largely by destudents david howison.",1995-1996
national liberal arts colleges are also highly selective but emphasize — and award more than 40 percent of their degrees in — the liberal arts.,1995-1996
"since the 1996 election, the liberal media has been chanting the mantra that the voters merely had a tantrum in 1994, denying any ideological bent to the change in the fervent hope that it will become accepted fact.",1995-1996
w&l ranked 15th in the national liberal arts colleges category.,1995-1996
"seniors especially need to be aware that the deadline for submitting resumes for j anuary’s selective liberal arts job fair is october 27. last year, the lob fair brought 131 employers to w&l to conduct oncampus interviews with seniors.",1995-1996
he also illustrated a very important ﬂaw in modem liberalism.,1995-1996
"at its root, there is little to be faulted in liberalism.",1995-1996
"liberalism incessantly promotes a crisis mentality, in order to provide some justiﬁcation, however specious, for the expansion of government to deal with the current exigency.",1995-1996
"rather, it represents nothing more than liberal demagoguing on the issue of race, and it only succeeds in trivializing the nazi regime.",1995-1996
",.,and,,l_est you think this propensity  ,fo""r’”o”r’at’or’ical exaggeration is solely  an individual problem of""""mr. cochran’s, let me illustrate a few more examples of this never-ending liberal tendency toward irresponsibility and lack of perspective.",1995-1996
"and while environmentalists at its root, there is little to be faulted in liberalism.",1995-1996
"none of this is to say that legitimate oroblems don’t exist, but it greatly hurts efforts to solve these problems for liberals to abandon responsible debate in favor of scoring points with short-tenn fearmongering and irresponsible exaggeration.",1995-1996
"film society ‘  liberal arts and science mawashington and lee\'s film jors interested in the slac job society will present clerks friday, fairs should submit their resumes  by oct. 27. interested students can get more information by stopping by  there is no charge for admission and the career development and placel  the public as well as the w&l commerit office.",1995-1996
"1 5 p.m. 463-2186  advertsemen ts  the ring-tum phi, october 6, 1995  17 s. main st. 463-9730  florist to the homestead  washington and lee   « selective liberal arts consortium job fairs  iislter.\'\\/ievvs in: atlanta, chicago, dc, nezo york, philadelphia, san francisco  hu.man renourceslpersonnel ’ museums teachin coaching scientific writ-ing advertis.",1995-1996
intervievving event for liberal arts a\'nd science l\\/ia}ors!!,1995-1996
"‘  although the wildcats are not a member of the old dominion athletic conference, davidson and w&l are similar liberal arts colleges who have created a rivalry both’ on the field and in the classroom.",1995-1996
"in the 1995 u.s. news and world report rankings of the nation’s best liberal arts schools, w&l rated 15th, while davidson plunged to 21st after being ranked 8th in 1994.  on the gridiron, the generals also hold an edge, leading the all-time series, 16-10-1.  above: robert hull had 16 tackles in the \'94 homecoming game against randolph-macon.",1995-1996
robertson asked that we “leave him alone in his glory.”  he also completely revamped the curriculum for the college of william and mary by eliminating all religion courses and placing a heavy emphasis on the liberal arts.,1995-1996
slac job fairs  liberal arts and science majors interested in the slac job fairs should submit their resumes by oct. 27.  flu shots  student health will be giving ﬂu shots starting oct. 15. the cost is $5.,1995-1996
"coulling ‘46 presented “greetings from more than 19,000 alumni.” he claimed that elrod has gained their confidence through his own love of the university, his “appreciation of its tradition and heritage” and his strong “faith in the importance of liberal education.” coulling assured elrod the continued loyalty and support of the university’s many alumni.",1995-1996
"kuykendall chose to consider the seemingly questionable future of liberal learning, a timely topic in light of the university’s upcoming bicenquinquagenary (250th anniversary).",1995-1996
"john w. elrod inaugurated»  up elrod, from page 1  think about the value of liberal arts institutions such as w&l.",1995-1996
"by self-consciousness, kuykendall was referring to the idea that people who attend small liberal arts institutions take themselves seriously and come with a desire to grow.",1995-1996
a liberal arts education teaches us to ask “why” things are the way they are rather than practicing blind acceptance.,1995-1996
. . useless presents like books which told me everything about the wasp but why.”’ our mission is to realize and teach the necessity of asking “why?” in order to ﬁnd “the best and most appropriate way to say because.”  liberal learning insists upon probing further with “whys” so that students may make careful choices.,1995-1996
"this is a crucial part of liberal learning, as we strive to “understand the connections between and among all of the things we learn” claims kuykendall.",1995-1996
"“the far middle” is a term invented by cartoonist jeff macnelly of the chicago tribune in his comic strip, “pluggers,” to describe the giant gulf that exists between the failed liberal agenda represented by the democrats and the frankly frightening stridency of the far right which seems to have taken over the republican party.",1995-1996
"liberalism had died long before that, but somehow the democrats were able to throw up a president with their dying breath.",1995-1996
"there are two more days of practice interviewing this term: wednesday, oct. 25 and thursday, nov. 9.  general  notes     slac job fairs  liberal arts and science majors interested in the slac job fairs should submit their resumés by oct. 27.  study in hong kong  there’s still time to apply for a year in hong kong at chung chi university!",1995-1996
-——--—-— c ‘—--—-j group for liberal whileitisnot causes at all a partisan   tax.,1995-1996
"name liberal organizations that  non-governmental policy groups with  the american bar association     use large por he or she dis_ received $2.2 miltions of their . . lion in tax dollars budget to lobby ¢lg7\'€€sthls vlolates between july the federal govthe heart of 1993 and july z""‘.‘“§""§.",1995-1996
and there are dozens of other examples of liberal groups funded in various ways.,1995-1996
"ironically, liberals’ main argument against the istook amendment sounds  will destroy the first amendment’s rights to free speech and to petition the government.",1995-1996
the only reason this bill has any “partisan” character at all is that liberal interest groups are desperate to protect their main source of funding: the bloated federal government.,1995-1996
the outrage of liberals on this issue immediately leads one to ask why they can’t raise money without coercing it fromthe taxpayer.,1995-1996
"the american taxpayer should not be forced to pay for the life support of these relics of the discredited big-government, social-engineering liberal agenda, especially in a time of fiscal responsibility.",1995-1996
"you’ve probably ,heard the many outraged liberal denunciations of this book.",1995-1996
"i bought d’souza’s book partly because i figured that if it had drawn such condemnation from the entrenched liberal civil rights establishment, it probably had more than a grain of truth to it.",1995-1996
"d’souza provides an in depth look at the origins of the modern liberal commitment to group equality and proportional representation, ideas that have become gospel without any serious reasoned support.",1995-1996
d’souza presents the central dilemma for liberals clearly.,1995-1996
yet liberals have been puzzled as to why a reliance on merit has not produced a greater change in black achievement.,1995-1996
"however, many liberal civil rights’ activists see this as insufficient and reject all merit-based standardized tests, which invariably show a large gap between white and black achievement.",1995-1996
these large merit gaps have led liberal coalitions to oppose all testing and job qualification standards as inherently racist.,1995-1996
"he argues that having achieved formal equality, blacks must now address these cultural problems, which liberals refuse to acknowledge because it threatens their belief in cultural relativism.",1995-1996
"“in most law schools, the liberal view of law is far ahead.” ‘  he argued that most law schools and schools in general have become politicized.",1995-1996
"“we expect this to be our most successful contest ever, and hope that members of the w&l community as well as  irobert bork critiques supreme court  he said the supreme court is simply pushing a modern liberal agenda.",1995-1996
"liberals applaud draconian environmental restrictions, which have jailed people for filling in puddles on their property with soil.",1995-1996
"as a senior in high school, he knew he  , wanted a small liberal arts col lege with “an excellent academic reputation and that had lots of mountains and rivers around it.” he thought about attending law school one day but didn’t set any specific goals.",1995-1996
"after all, this campus is not a hotbed of radical liberalism, multi-culturalism, or rabid affirmitve action supporters.",1995-1996
"o’rourke castigates whiners of america  my view  celeste rasmussen, ’98  when debating about politics with some of my liberal friends, factual contentions and constructive reasoning usually turn into dirty attacks.",1995-1996
that all slurs clauseassuperior lar liberal views on.,1995-1996
"page 4  ellie ring-tum lﬂlii  the student voice of washington and lee founded september 18, 1897  journalism’s invisible choices  in today’s political climate, journalists, whether in print or broadcast, are vilified as cold-hearted, aggressive, liberal and amoral individuals.",1995-1996
"so here’s my take on it: you see, while i do think that the media has a bit of a liberal bias, i don’t see that as their main problem.",1995-1996
"key qualifications include an interest in banking, scholastic and leadership excellence and all maiors (including all liberal arts or science majors as well as commerce majors).",1995-1996
"america has not been racist, and liberals’ contention that it is only hurts black peoplenot help them.",1995-1996
liberal arguments about discrimination and racism are based on hogwash.,1995-1996
"the book is called the machinery of freedom, and i will quote from it liberally.",1995-1996
they argue that  such majors detract from what a liberal arts educa tion should be ‘arid serves asa rjoliticaltoolofthe left‘  to indoctrinate students with their “agenda.,1996-1997
"she believes that “every liberal arts college needs a dance program,” especially  oneaswell-known and\'respectedaswash ington and lee.",1996-1997
but although our liberal arts education here at w&l does some things to make us well-rounded individualsﬂ think it’s the experience that we have here that allows  .,1996-1997
"but contrary to what the liberal media would have you believe, the republican party need not fear the issue or the platform plank.",1996-1997
"students will not have a major, but will all take core courses focusing on “great books.”  the “great books” program is modeled after the curriculum at st. john’s college, a very small liberal arts college in annapolis, maryland.",1996-1997
"just swipe your university card, wait’for the green light, the door unlocks, and  general notes  according to information released by u.s. news & world report magazine, washington and lee university is now ranked 13th among the nations top liberal arts colleges and universities.",1996-1997
"approximately seven hundred and fifty students, faculty members, and visitors swarmed into the warner center to hear  brownlee speak on the value of a liberal arts education.",1996-1997
"many of you may remember hearing in econ 101 that if the mandated minimum wage is higher than the benefits a business would reap from hiring another worker, that business will refrain from hir are you a liberal democrat?",1996-1997
"but the next time you hear a liberal democrat telling you hoe government can intervene in the economy, whether in the realm of health care, the minimum wage, or some other measure, and not cause any problems, think about the extra course in economics w&l work-study students are receiving this fall.",1996-1997
"about 20_ blazers and sundresses start of the academic ye the event was held in t skyrocketed to what felt                                     through the fluttering of programs 0 hand-held fans, seniors listened to the w9  liberal arts education.",1996-1997
"for further assistance in ﬁnding internships, students should attend one of the internship workshops offered by the cdpo, which are targeted to particular interest areas, liberal arts/ fine arts, c-school, sciences and communications.",1996-1997
"the contrast between these two issues is what divides and defines liberals and conserva one of my favorite bumper stickers is the one that reads, “it will be a perfect world when the schools will have all the money they need, and the  a air force has to hold a bake sale to buy a bomber.” this seemingly innocent display of irony gets down to the meat and potatoes of this debate.",1996-1997
"if to be a liberal means that i think the us should spend its money on teaching a child how to  “it can be safely stated that military , spending in the united states is out of control and  needs t o be stopped.”  read rather than buying an m-16, then i’ll stand on the top of washington hall and yell it to all of w&l and lexington.",1996-1997
but liberals believe that the federal government has the ability to be a positive institution by providing american citizens an equal opportunity through increased social programs.,1996-1997
"author d’souza speaks on racism  _ . dinesh d’souza, author of the end ofracism, will speak at lee chapel on oct.\'30 at 7 p.m. d’souza believes that the  goals of liberal education are lost and freedoms of speech and  thought are imperiled.",1996-1997
and talk to us  when its partytzmef qualifications...  -cumulative gpa of 3.0 -liberal arts or business degree .leadership skills i ‘ storig analytical skills  people who do well at may have...  -ability to produce results -ability to energize others the desire to learn -strong organizational skills  ‘advance notice required.,1996-1997
these restrictions have been nixed to allow more liberal contact rules.,1996-1997
"lailiguageouozf :ociai 0’ otyertypes ofethmc mus"": may see blackmer swebpagfas varlory of groups including arc of rockbridge the goals of a liberal education are lost, and the freescience and academia.",1996-1997
